claimID,claim,label,claimURL,reason,categories,speaker,checker,tags,article title,publish date,climate,entities,original_split,claim_normalised,categories_list,tags_list,category_text,tag_text,metadata_text,word_count,factcheck_domain,finance_metadata_match
snes-04619,JetBlue is offering free flights to Orlando for family members and partners of the victims of the Pulse Nightclub shooting.,true,https://www.snopes.com/fact-check/jetblue-offering-free-flights-to-orlando-for-victims-families/,,Business,,Kim LaCapria,,JetBlue Offering Free Flights to Pulse Nightclub Victims’ Families,13 June 2016,,"['Orlando,_Florida', 'JetBlue']",train,jetblue is offering free flights to orlando for family members and partners of the victims of the pulse nightclub shooting,['Business'],[],Business,,business | ,20,www.snopes.com,True
snes-00906,Did Harley-Davidson Close a Wisconsin Factory to Move Production to Thailand Due to New Steel Tariffs?,mostly false,https://www.snopes.com/fact-check/harley-davidson-steel-tariffs/,,Business,,Dan Evon,,Did Harley-Davidson Close a Wisconsin Factory to Move Production to Thailand Due to New Steel Tariffs?,12 March 2018,,['None'],train,did harley davidson close a wisconsin factory to move production to thailand due to new steel tariffs,['Business'],[],Business,,business | ,16,www.snopes.com,True
snes-05671,Congress voted to give Apache land to an environmentally exploitative foreign corporation.,mixture,https://www.snopes.com/fact-check/congress-votes-to-sell-apache-land-to-foreign-corporation/,,Business,,Kim LaCapria,,Congress Voted to Sell Apache Land to Foreign Corporation?,12 December 2014,,['None'],train,congress voted to give apache land to an environmentally exploitative foreign corporation,['Business'],[],Business,,business | ,12,www.snopes.com,True
farg-00146,"The Republican tax plans are ""going to be a job-killer.”",misleading,https://www.factcheck.org/2017/11/pelosis-misleading-job-killer-claim/,,the-factcheck-wire,Rep. Nancy Pelosi,Robert Farley,['GDP'],Pelosi’s Misleading ‘Job-Killer’ Claim,"November 29, 2017","[' NBC\'s ""Meet the Press"" – Sunday, November 26, 2017 ']",['Republican_Party_(United_States)'],train,the republican tax plans are going to be a job killer,['the-factcheck-wire'],['GDP'],the-factcheck-wire,GDP,the-factcheck-wire | gdp,10,www.factcheck.org,True
para-00058,"Australia is ""borrowing 86 per cent of our gross debt from the rest of the world"".",mostly false,http://pandora.nla.gov.au//pan/140601/20131209-1141/www.politifact.com.au/truth-o-meter/statements/2013/aug/23/joe-hockey/debt-wars-Labor-selling-off-foreigners-Hockey/index.html,,"['Budget', 'Debt']",Joe Hockey,"Chris Pash, Peter Fray",,"Debt wars, part IV: Labor's selling out the country to foreigners, says Hockey","Friday, August 23, 2013 at 1:04 p.m.",,['None'],train,australia is borrowing 86 per cent of our gross debt from the rest of the world,"['Budget', 'Debt']",[],Budget | Debt,,budget | debt | ,16,pandora.nla.gov.au,True
thet-00038,There is no evidence that joining the EEC or the single market boosted UK growth so it's difficult to see how leaving will do the opposite.,mostly false,https://theferret.scot/eu-eec-uk-gdp-growth/,,Fact check Finance ,John Redwood MP,,,MP’s claim joining EEC did not boost UK growth is Mostly False,"November 22, 2017",,['None'],train,there is no evidence that joining the eec or the single market boosted uk growth so it s difficult to see how leaving will do the opposite,['Fact check Finance'],[],Fact check Finance,,fact check finance | ,26,theferret.scot,True
tron-00539,Chick-fil-A CEO Dan Cathy Says ‘We Don’t Like Blacks Either’,fiction!,https://www.truthorfiction.com/dan-cathy-dont-like-blacks/,,business,,,"['LGBT', 'satire', 'social media']",Chic-fil-A CEO Dan Cathy Says ‘We Don’t Like Blacks Either’,"Jun 26, 2017",,['None'],train,chick fil a ceo dan cathy says we don t like blacks either,['business'],"['LGBT', 'satire', 'social media']",business,LGBT | satire | social media,business | lgbt | satire | social media,10,www.truthorfiction.com,True
tron-00524,AmazonSmile Removes Pro-Family Groups from Eligible Charities,mostly truth!,https://www.truthorfiction.com/amazonsmile-removes-pro-family-groups-from-eligible-charities-mostly-truth/,,business,,,"['Amazon', 'charities', 'religion']",AmazonSmile Removes Pro-Family Groups from Eligible Charities,"May 16, 2018",,['None'],train,amazonsmile removes pro family groups from eligible charities,['business'],"['Amazon', 'charities', 'religion']",business,Amazon | charities | religion,business | amazon | charities | religion,7,www.truthorfiction.com,True
para-00012,"Electricity is inelastic and taxing it ""simply ends up diverting funds from other elements in a family's budget"".",half-true,http://pandora.nla.gov.au//pan/140601/20131209-1141/www.politifact.com.au/truth-o-meter/statements/2013/oct/24/greg-hunt/Hunt-stretching-truth-electricity/index.html,,"['Carbon Tax', 'Cost of living', 'Economy', 'Environment']",Greg Hunt,"Michael Koziol, Peter Fray",,Is Hunt stretching the truth about electricity?,"Thursday, October 24, 2013 at 5:07 p.m.",,['None'],train,electricity is inelastic and taxing it simply ends up diverting funds from other elements in a family s budget,"['Carbon Tax', 'Cost of living', 'Economy', 'Environment']",[],Carbon Tax | Cost of living | Economy | Environment,,carbon tax | cost of living | economy | environment | ,18,pandora.nla.gov.au,True
abbc-00078,The claim: Barry O'Farrell says single-decker trains can carry more people than double-decker ones because people can move on and off more quickly.,in-the-red,http://www.abc.net.au/news/2014-04-11/barry-ofarrell-sydney-trains-claim-doubtful/5371446,The claim: Barry O'Farrell says single-decker trains can carry more people than double-decker ones because people can move on and off more quickly.,"['rail-transport', 'industry', 'business-economics-and-finance', 'states-and-territories', 'government-and-politics', 'federal---state-issues', 'sydney-2000', 'nsw', 'australia']",,,"['rail-transport', 'industry', 'business-economics-and-finance', 'states-and-territories', 'government-and-politics', 'federal---state-issues', 'sydney-2000', 'nsw', 'australia']",Single-decker v double-decker trains: Barry O'Farrell's claim doubtful,"Mon 14 Apr 2014, 8:28am",,['None'],train,the claim barry o farrell says single decker trains can carry more people than double decker ones because people can move on and off more quickly,"['rail-transport', 'industry', 'business-economics-and-finance', 'states-and-territories', 'government-and-politics', 'federal---state-issues', 'sydney-2000', 'nsw', 'australia']","['rail-transport', 'industry', 'business-economics-and-finance', 'states-and-territories', 'government-and-politics', 'federal---state-issues', 'sydney-2000', 'nsw', 'australia']",rail-transport | industry | business-economics-and-finance | states-and-territories | government-and-politics | federal---state-issues | sydney-2000 | nsw | australia,rail-transport | industry | business-economics-and-finance | states-and-territories | government-and-politics | federal---state-issues | sydney-2000 | nsw | australia,rail-transport | industry | business-economics-and-finance | states-and-territories | government-and-politics | federal---state-issues | sydney-2000 | nsw | australia | rail-transport | industry | business-economics-and-finance | states-and-territories | government-and-politics | federal---state-issues | sydney-2000 | nsw | australia,23,www.abc.net.au,True
tron-00562,AAA Warns Motorists Not to Use E15 Gasoline,outdated!,https://www.truthorfiction.com/aaa-warns-motorists-not-use-e15-gasoline/,,business,,,,AAA Warns Motorists Not to Use E15 Gasoline,"Apr 19, 2016",,['None'],train,aaa warns motorists not to use e15 gasoline,['business'],[],business,,business | ,8,www.truthorfiction.com,True
tron-00555,WhatsApp Gold or WhatsApp Plus Download Offer,scam!,https://www.truthorfiction.com/whatsapp-gold-or-whatsapp-plus-download-offer/,,business,,,,WhatsApp Gold or WhatsApp Plus Download Offer,"Jun 3, 2016",,['None'],train,whatsapp gold or whatsapp plus download offer,['business'],[],business,,business | ,7,www.truthorfiction.com,True
snes-04091,"A young couple was assaulted in Chicago, causing them to move back to Arizona after just one day in the city.",unproven,https://www.snopes.com/fact-check/teenage-arizona-couple-moves-out-of-chicago-after-just-one-day-because-of-assault/,,Business,,Bethania Palma,,Teenage Arizona Couple Moves Out of Chicago After Just One Day Because of Assault?,6 September 2016,,"['Chicago', 'Arizona']",train,a young couple was assaulted in chicago causing them to move back to arizona after just one day in the city,['Business'],[],Business,,business | ,21,www.snopes.com,True
snes-04470,A biotech company has developed a 3D synthetic rhino horn that will eventually undercut the market for poached horns.,mixture,https://www.snopes.com/fact-check/3d-printed-rhino-horn-developed/,,Business,,Kim LaCapria,,Have 3D Printed Rhino Horns Been Developed to Stop Poaching?,11 July 2016,,['None'],train,a biotech company has developed a 3d synthetic rhino horn that will eventually undercut the market for poached horns,['Business'],[],Business,,business | ,19,www.snopes.com,True
para-00092,"Australia's debt is growing faster than at any other time in recorded history, more than double that predicted even just before the last election.",mostly false,http://pandora.nla.gov.au//pan/140601/20131209-1141/www.politifact.com.au/truth-o-meter/statements/2013/aug/01/andrew-robb/Debt-growing-faster-now-than-history/index.html,,['Debt'],Andrew Robb,"Peter Martin, Peter Fray",,Debt growing faster now than ever before: Robb,"Thursday, August 1, 2013 at 4:37 p.m.",,['None'],train,australia s debt is growing faster than at any other time in recorded history more than double that predicted even just before the last election,['Debt'],[],Debt,,debt | ,24,pandora.nla.gov.au,True
abbc-00375,Commonwealth funding for Sydney's WestConnex road project has been a central tenet of the Liberal party's policy platform for some time.,in-between,http://www.abc.net.au/news/2014-07-27/sydney-westconnex-promise-check/5505696,,"['road-transport', 'industry', 'business-economics-and-finance', 'liberals', 'abbott-tony', 'federal-government', 'australia', 'sydney-2000', 'nsw']",,,"['road-transport', 'industry', 'business-economics-and-finance', 'liberals', 'abbott-tony', 'federal-government', 'australia', 'sydney-2000', 'nsw']",Promise check: $1.5 billion for Sydney's WestConnex,"Sun 8 May 2016, 7:37am",,"['Sydney', 'Commonwealth_of_Nations']",train,commonwealth funding for sydney s westconnex road project has been a central tenet of the liberal party s policy platform for some time,"['road-transport', 'industry', 'business-economics-and-finance', 'liberals', 'abbott-tony', 'federal-government', 'australia', 'sydney-2000', 'nsw']","['road-transport', 'industry', 'business-economics-and-finance', 'liberals', 'abbott-tony', 'federal-government', 'australia', 'sydney-2000', 'nsw']",road-transport | industry | business-economics-and-finance | liberals | abbott-tony | federal-government | australia | sydney-2000 | nsw,road-transport | industry | business-economics-and-finance | liberals | abbott-tony | federal-government | australia | sydney-2000 | nsw,road-transport | industry | business-economics-and-finance | liberals | abbott-tony | federal-government | australia | sydney-2000 | nsw | road-transport | industry | business-economics-and-finance | liberals | abbott-tony | federal-government | australia | sydney-2000 | nsw,21,www.abc.net.au,True
tron-00538,Verizon Backpack Giveaway in July 2017,truth!,https://www.truthorfiction.com/verizon-backpack-giveaway/,,business,,,"['business', 'facebook', 'social media']",Verizon Backpack Giveaway in July 2017,"Jul 13, 2017",,['None'],train,verizon backpack giveaway in july 2017,['business'],"['business', 'facebook', 'social media']",business,business | facebook | social media,business | business | facebook | social media,6,www.truthorfiction.com,True
tron-00533,Child Miners Exploited for Electric Car Batteries,misleading!,https://www.truthorfiction.com/child-miners-cobalt-electric-car/,,business,,,"['africa', 'china', 'climate change', 'electric cars']",Child Miners Exploited for Electric Car Batteries,"Aug 9, 2017",,['None'],train,child miners exploited for electric car batteries,['business'],"['africa', 'china', 'climate change', 'electric cars']",business,africa | china | climate change | electric cars,business | africa | china | climate change | electric cars,7,www.truthorfiction.com,True
farg-00091,"Corporate tax revenues are “still rising,” even though the tax rate “dropped 40 percent” under the new tax law.",misleading,https://www.factcheck.org/2018/04/paul-ryan-misleads-on-corporate-tax-revenues/,,the-factcheck-wire,Rep. Paul Ryan,Eugene Kiely,['Corporate tax'],Paul Ryan Misleads on Corporate Tax Revenues,"April 16, 2018","[' NBC\'s ""Meet the Press"" – Sunday, April 15, 2018 ']",['None'],train,corporate tax revenues are still rising even though the tax rate dropped 40 percent under the new tax law,['the-factcheck-wire'],['Corporate tax'],the-factcheck-wire,Corporate tax,the-factcheck-wire | corporate tax,19,www.factcheck.org,True
vees-00364,VERA FILES FACT SHEET: The 1993 secret deal: what the Marcoses wanted in exchange for their ill-gotten wealth,none,http://verafiles.org/articles/vera-files-fact-sheet-1993-secret-deal-what-marcoses-wanted,,,,,"Duterte,Marcos,Supreme Court,Marcos wealth,pcgg",VERA FILES FACT SHEET: The 1993 secret deal: what the Marcoses wanted in exchange for their ill-gotten wealth,"September 28, 2017",,['None'],train,vera files fact sheet the 1993 secret deal what the marcoses wanted in exchange for their ill gotten wealth,[],"['Duterte', 'Marcos', 'Supreme Court', 'Marcos wealth', 'pcgg']",,Duterte | Marcos | Supreme Court | Marcos wealth | pcgg, | duterte | marcos | supreme court | marcos wealth | pcgg,18,verafiles.org,True
fani-00011,CLAIM: There was a rock fall on the Antrim coast road on 9 August 2017.,conclusion: false,https://factcheckni.org/facts/did-a-large-rock-fall-onto-the-antrim-coast-road/,,economy,,,,Did a large rock fall onto the Antrim coast road?,,,['None'],train,claim there was a rock fall on the antrim coast road on 9 august 2017,['economy'],[],economy,,economy | ,15,factcheckni.org,True
abbc-00390,The claim: Christopher Pyne says university students have a less than 1 per cent unemployment rate and over a lifetime earn 75 per cent more than someone who doesn't go to university.,in-between,http://www.abc.net.au/news/2014-05-29/pyne-graduate-earnings-and-unemployment-claim-overblown/5446462,The claim: Christopher Pyne says university students have a less than 1 per cent unemployment rate and over a lifetime earn 75 per cent more than someone who doesn't go to university.,"['education-industry', 'access-to-education', 'work', 'unemployment', 'adult-education', 'education', 'educational-resources', 'university-and-further-education', 'liberals', 'federal-government', 'government-and-politics', 'budget', 'australia']",,,"['education-industry', 'access-to-education', 'work', 'unemployment', 'adult-education', 'education', 'educational-resources', 'university-and-further-education', 'liberals', 'federal-government', 'government-and-politics', 'budget', 'australia']",Christopher Pyne's claim that graduates earn more is overblown,"Tue 9 Sep 2014, 3:32am",,['None'],train,the claim christopher pyne says university students have a less than 1 per cent unemployment rate and over a lifetime earn 75 per cent more than someone who doesn t go to university,"['education-industry', 'access-to-education', 'work', 'unemployment', 'adult-education', 'education', 'educational-resources', 'university-and-further-education', 'liberals', 'federal-government', 'government-and-politics', 'budget', 'australia']","['education-industry', 'access-to-education', 'work', 'unemployment', 'adult-education', 'education', 'educational-resources', 'university-and-further-education', 'liberals', 'federal-government', 'government-and-politics', 'budget', 'australia']",education-industry | access-to-education | work | unemployment | adult-education | education | educational-resources | university-and-further-education | liberals | federal-government | government-and-politics | budget | australia,education-industry | access-to-education | work | unemployment | adult-education | education | educational-resources | university-and-further-education | liberals | federal-government | government-and-politics | budget | australia,education-industry | access-to-education | work | unemployment | adult-education | education | educational-resources | university-and-further-education | liberals | federal-government | government-and-politics | budget | australia | education-industry | access-to-education | work | unemployment | adult-education | education | educational-resources | university-and-further-education | liberals | federal-government | government-and-politics | budget | australia,32,www.abc.net.au,True
farg-00317,"“Bob Casey wants to fire the incredible men and women of ICE. He wants to abolish ICE, because he’s weak.”",false,https://www.factcheck.org/2018/08/a-rally-filled-with-repeats/,,featured-posts,FactCheck.org,Robert Farley,['estate tax'],A Rally Filled with Repeats,"August 7, 2018",2018-08-07 13:22:39 UTC,['None'],train,bob casey wants to fire the incredible men and women of ice he wants to abolish ice because he s weak,['featured-posts'],['estate tax'],featured-posts,estate tax,featured-posts | estate tax,20,www.factcheck.org,True
abbc-00094,"The claim: Chris Bowen says the Government's decision to scrap a $2,000 cap on self-education expenses will allow people to travel as much as they like and claim as much as they like.",in-the-red,http://www.abc.net.au/news/2013-11-21/chris-bowen-wrong-self-education-expenses/5099582,"The claim: Chris Bowen says the Government's decision to scrap a $2,000 cap on self-education expenses will allow people to travel as much as they like and claim as much as they like.","['tax', 'alp', 'education', 'professional-development', 'education-industry', 'continuing-education', 'adult-education', 'access-to-education', 'university-and-further-education', 'chris-bowen', 'rural', 'australia', 'university-of-new-england-2351', 'the-university-of-sydney-2006', 'university-of-melbourne-3010']",,,"['tax', 'alp', 'education', 'professional-development', 'education-industry', 'continuing-education', 'adult-education', 'access-to-education', 'university-and-further-education', 'chris-bowen', 'rural', 'australia', 'university-of-new-england-2351', 'the-university-of-sydney-2006', 'university-of-melbourne-3010']",Chris Bowen wrong on Government's decision to scrap self-education expenses cap,"Fri 22 Nov 2013, 9:10am",,['None'],train,the claim chris bowen says the government s decision to scrap a 2 000 cap on self education expenses will allow people to travel as much as they like and claim as much as they like,"['tax', 'alp', 'education', 'professional-development', 'education-industry', 'continuing-education', 'adult-education', 'access-to-education', 'university-and-further-education', 'chris-bowen', 'rural', 'australia', 'university-of-new-england-2351', 'the-university-of-sydney-2006', 'university-of-melbourne-3010']","['tax', 'alp', 'education', 'professional-development', 'education-industry', 'continuing-education', 'adult-education', 'access-to-education', 'university-and-further-education', 'chris-bowen', 'rural', 'australia', 'university-of-new-england-2351', 'the-university-of-sydney-2006', 'university-of-melbourne-3010']",tax | alp | education | professional-development | education-industry | continuing-education | adult-education | access-to-education | university-and-further-education | chris-bowen | rural | australia | university-of-new-england-2351 | the-university-of-sydney-2006 | university-of-melbourne-3010,tax | alp | education | professional-development | education-industry | continuing-education | adult-education | access-to-education | university-and-further-education | chris-bowen | rural | australia | university-of-new-england-2351 | the-university-of-sydney-2006 | university-of-melbourne-3010,tax | alp | education | professional-development | education-industry | continuing-education | adult-education | access-to-education | university-and-further-education | chris-bowen | rural | australia | university-of-new-england-2351 | the-university-of-sydney-2006 | university-of-melbourne-3010 | tax | alp | education | professional-development | education-industry | continuing-education | adult-education | access-to-education | university-and-further-education | chris-bowen | rural | australia | university-of-new-england-2351 | the-university-of-sydney-2006 | university-of-melbourne-3010,33,www.abc.net.au,True
snes-06169,An illustration from a withdrawn Yellow Pages ad reveals a risqué image when a portion of it is viewed upside-down.,true,https://www.snopes.com/fact-check/i-am-curious-yellow-pages/,,Risqué Business,,David Mikkelson,,I Am Curious (Yellow Pages),7 January 2006,,['None'],train,an illustration from a withdrawn yellow pages ad reveals a risqué image when a portion of it is viewed upside down,['Risqué Business'],[],Risqué Business,,risqué business | ,20,www.snopes.com,True
snes-00405,Did Harley Davidson’s CEO Call President Trump ‘a Moron’?,false,https://www.snopes.com/fact-check/did-ceo-harley-davidson-trump-moron/,,Business,,Kim LaCapria,,Did Harley Davidson’s CEO Call President Trump ‘a Moron’?,27 June 2018,,['None'],train,did harley davidson s ceo call president trump a moron,['Business'],[],Business,,business | ,9,www.snopes.com,True
para-00099,Labor put Australia among the top ten foreign aid givers worldwide.,mostly true,http://pandora.nla.gov.au//pan/140601/20131209-1141/www.politifact.com.au/truth-o-meter/statements/2013/jul/26/andrew-leigh/how-generous-australia-foreign-aid/index.html,,['Budget'],Andrew Leigh,"Michael Koziol, Peter Fray",,How generous is Australia on foreign aid?,"Friday, July 26, 2013 at 5:04 p.m.",,['None'],train,labor put australia among the top ten foreign aid givers worldwide,['Budget'],[],Budget,,budget | ,11,pandora.nla.gov.au,True
abbc-00194,"The claim: Clive Palmer is constantly referred to as a billionaire in the media, but the man himself has been vague on the details of his wealth.",in-the-green,http://www.abc.net.au/news/2013-11-25/clive-palmer-is-a-billionaire/5002500,"The claim: Clive Palmer is constantly referred to as a billionaire in the media, but the man himself has been vague on the details of his wealth.","['clive-palmer', 'minor-parties', 'federal-government', 'mining-industry', 'business-economics-and-finance', 'qld', 'coolum-beach-4573', 'maroochydore-4558', 'australia']",,,"['clive-palmer', 'minor-parties', 'federal-government', 'mining-industry', 'business-economics-and-finance', 'qld', 'coolum-beach-4573', 'maroochydore-4558', 'australia']",Doing the sums: How much is Clive Palmer worth?,"Wed 22 Jan 2014, 4:34am",,['None'],train,the claim clive palmer is constantly referred to as a billionaire in the media but the man himself has been vague on the details of his wealth,"['clive-palmer', 'minor-parties', 'federal-government', 'mining-industry', 'business-economics-and-finance', 'qld', 'coolum-beach-4573', 'maroochydore-4558', 'australia']","['clive-palmer', 'minor-parties', 'federal-government', 'mining-industry', 'business-economics-and-finance', 'qld', 'coolum-beach-4573', 'maroochydore-4558', 'australia']",clive-palmer | minor-parties | federal-government | mining-industry | business-economics-and-finance | qld | coolum-beach-4573 | maroochydore-4558 | australia,clive-palmer | minor-parties | federal-government | mining-industry | business-economics-and-finance | qld | coolum-beach-4573 | maroochydore-4558 | australia,clive-palmer | minor-parties | federal-government | mining-industry | business-economics-and-finance | qld | coolum-beach-4573 | maroochydore-4558 | australia | clive-palmer | minor-parties | federal-government | mining-industry | business-economics-and-finance | qld | coolum-beach-4573 | maroochydore-4558 | australia,27,www.abc.net.au,True
tron-00547,General Mills Donates to Local Food Bank With Every Text,outdated!,https://www.truthorfiction.com/general-mills-food-bank-text/,,business,,,"['facebook', 'products']",General Mills Donates to Local Food Bank With Every Text,"Mar 7, 2017",,['None'],train,general mills donates to local food bank with every text,['business'],"['facebook', 'products']",business,facebook | products,business | facebook | products,10,www.truthorfiction.com,True
snes-04196,A KFC promotion offered Extra Crispy Sunscreen to consumers.,true,https://www.snopes.com/fact-check/kfc-extra-crispy-sunscreen/,,Business,,Dan Evon,,KFC Extra Crispy Sunscreen,23 August 2016,,['None'],train,a kfc promotion offered extra crispy sunscreen to consumers,['Business'],[],Business,,business | ,9,www.snopes.com,True
