claimID,claim,label,claimURL,reason,categories,speaker,checker,tags,article title,publish date,climate,entities,original_split,claim_normalised,categories_list,tags_list,category_text,tag_text,metadata_text,word_count,factcheck_domain,finance_metadata_match
snes-06290,"Coca-Cola's initial transliteration of its name into Chinese produced a rendering whose meaning was ""bite the wax tadpole.""",mixture,https://www.snopes.com/fact-check/bite-the-wax-tadpole/,,Business,,David Mikkelson,,Bite the Wax Tadpole,19 May 2011,,"['China', 'Coca-Cola']",train,coca cola s initial transliteration of its name into chinese produced a rendering whose meaning was bite the wax tadpole,['Business'],[],Business,,business | ,18,www.snopes.com,True
snes-02025,Graham crackers were named for a man who believed unhealthy diet led to sexual excess.,true,https://www.snopes.com/fact-check/graham-cracker-origins/,,Risqué Business,,David Mikkelson,,The Origin of Graham Crackers,20 August 2002,,['None'],train,graham crackers were named for a man who believed unhealthy diet led to sexual excess,['Risqué Business'],[],Risqué Business,,risqué business | ,15,www.snopes.com,True
abbc-00023,"Despite its wishful thinking, the Turnbull Government's May 2 announcement of ""new record growing funding for Australian schools"" has not brought ""the school funding wars to an end"".",in-the-red,http://www.abc.net.au/news/2017-06-05/fact-check-has-the-government-cut-22bn-from-schools/8526768,,"['health-policy', 'budget', 'alp']",,,"['health-policy', 'budget', 'alp']",Fact check: Has the Government cut $22 billion from schools?,"Sun 4 Jun 2017, 10:47pm",,['Australia'],train,despite its wishful thinking the turnbull government s may 2 announcement of new record growing funding for australian schools has not brought the school funding wars to an end,"['health-policy', 'budget', 'alp']","['health-policy', 'budget', 'alp']",health-policy | budget | alp,health-policy | budget | alp,health-policy | budget | alp | health-policy | budget | alp,28,www.abc.net.au,True
snes-05962,A woman sought medical help to remove a deer tongue she had used for self-pleasuring purposes.,true,https://www.snopes.com/fact-check/deerly-beloved/,,Risqué Business,,David Mikkelson,,Xenolingual Autoeroticism,17 June 2004,,['None'],train,a woman sought medical help to remove a deer tongue she had used for self pleasuring purposes,['Risqué Business'],[],Risqué Business,,risqué business | ,16,www.snopes.com,True
snes-01336,DNA testing companies admitted to tampering with results in order to agitate racist customers.,mostly false,https://www.snopes.com/fact-check/dna-testing-companies-admit-altering-tests-screw-racists/,,Business,,Kim LaCapria,,Did DNA Testing Companies Admit to Altering Tests to ‘Screw with Racists’?,13 December 2017,,['None'],train,dna testing companies admitted to tampering with results in order to agitate racist customers,['Business'],[],Business,,business | ,14,www.snopes.com,True
para-00108,Japan has become the world’s third largest economy by processing Australian resources.,mostly true,http://pandora.nla.gov.au//pan/140601/20131209-1141/www.politifact.com.au/truth-o-meter/statements/2013/jul/17/clive-palmer/did-australian-resources-build-japan/index.html,,"['Economy', 'Mining']",Clive Palmer,"Ellie Harvey, Peter Fray",,Palmer says Japan is world's third largest economy by processing Australian resources,"Wednesday, July 17, 2013 at 1:04 p.m.",,"['Japan', 'Australia']",train,japan has become the world s third largest economy by processing australian resources,"['Economy', 'Mining']",[],Economy | Mining,,economy | mining | ,12,pandora.nla.gov.au,True
abbc-00249,"In recent weeks, the Government has sought to turn the focus of the political debate onto the economy.",in-between,http://www.abc.net.au/news/2017-10-13/fact-check-wii-australia-be-uncompetitive-on-company-tax/9033940,"Mr Morrison is close to the mark. The Treasurer accurately points to a widening gap between Australia's company tax rate and that of many other countries. Where there has been a global trend to lower company taxes, Australia has not reduced company tax for most businesses since 2000. Australia's company tax rate (30 per cent for most businesses) already compares unfavourably with that of Singapore (17 per cent) and the United Kingdom (19 per cent). And while the United States currently has a higher company tax rate than Australia (35 per cent or over 39 per cent if state taxes are included), the Republican administration is pushing to reduce that rate to 20 per cent. While Australian resident shareholders may see little direct benefit from company tax cuts due to Australia's imputation tax credit system, it is clear that many foreign investors compare company tax rates when deciding where to invest. But it is not the only factor influencing investment. And even if the Labor Party caves in and agrees to the Government's company tax proposals, this would only result in a reduction over time to 25 per cent. Australia would continue to compare unfavourably to Singapore, the UK (which is scheduled to reduce its rate to 17 per cent over the same period) and possibly the United States.","['tax', 'liberals', 'scott-morrison', 'australia']",,,"['tax', 'liberals', 'scott-morrison', 'australia']",Fact check: Will Australia be uncompetitive on company tax if the Government's reforms fail?,"Thu 30 Nov 2017, 2:56am",,['None'],train,in recent weeks the government has sought to turn the focus of the political debate onto the economy,"['tax', 'liberals', 'scott-morrison', 'australia']","['tax', 'liberals', 'scott-morrison', 'australia']",tax | liberals | scott-morrison | australia,tax | liberals | scott-morrison | australia,tax | liberals | scott-morrison | australia | tax | liberals | scott-morrison | australia,18,www.abc.net.au,True
abbc-00432,"The claim: Joe Hockey says the Coalition left the country with net assets of $70 billion, whereas if it wins the election he says it will inherit debt going to $400 billion.",in-between,http://www.abc.net.au/news/2013-08-19/joe-hockey-exaggerates-debt-figures/4897264,"The claim: Joe Hockey says the Coalition left the country with net assets of $70 billion, whereas if it wins the election he says it will inherit debt going to $400 billion.","['budget', 'federal-government', 'federal-elections', 'liberals', 'hockey-joe', 'business-economics-and-finance', 'australia']",,,"['budget', 'federal-government', 'federal-elections', 'liberals', 'hockey-joe', 'business-economics-and-finance', 'australia']","Joe Hockey exaggerates difference between Labor, Coalition record on debt","Fri 9 May 2014, 8:49am",,"['Coalition_(Australia)', 'Joe_Hockey']",train,the claim joe hockey says the coalition left the country with net assets of 70 billion whereas if it wins the election he says it will inherit debt going to 400 billion,"['budget', 'federal-government', 'federal-elections', 'liberals', 'hockey-joe', 'business-economics-and-finance', 'australia']","['budget', 'federal-government', 'federal-elections', 'liberals', 'hockey-joe', 'business-economics-and-finance', 'australia']",budget | federal-government | federal-elections | liberals | hockey-joe | business-economics-and-finance | australia,budget | federal-government | federal-elections | liberals | hockey-joe | business-economics-and-finance | australia,budget | federal-government | federal-elections | liberals | hockey-joe | business-economics-and-finance | australia | budget | federal-government | federal-elections | liberals | hockey-joe | business-economics-and-finance | australia,32,www.abc.net.au,True
tron-00580,Southwest Airlines Offers Free Tickets on Facebook,fiction!,https://www.truthorfiction.com/southwest-airlines-offers-free-tickets-on-facebook/,,business,,,,Southwest Airlines Offers Free Tickets on Facebook,"May 20, 2015",,['None'],train,southwest airlines offers free tickets on facebook,['business'],[],business,,business | ,7,www.truthorfiction.com,True
thet-00069,Is productivity growing faster in Scotland than the UK?,none,https://theferret.scot/productivity-growing-faster-scotland-uk/,,Fact check Finance ,,,,Is productivity growing faster in Scotland than the UK?,"June 4, 2017",,['Scotland'],train,is productivity growing faster in scotland than the uk,['Fact check Finance'],[],Fact check Finance,,fact check finance | ,9,theferret.scot,True
tron-00540,"Taco Bell Files For Bankruptcy, Closing All Restaurants",fiction!,https://www.truthorfiction.com/taco-bell-files-bankruptcy/,,business,,,"['business', 'facebook', 'satire']","Taco Bell Files For Bankruptcy, Closing All Restaurants"," May 25, 2017",,['None'],train,taco bell files for bankruptcy closing all restaurants,['business'],"['business', 'facebook', 'satire']",business,business | facebook | satire,business | business | facebook | satire,8,www.truthorfiction.com,True
snes-05843,The fashion of sagging one's pants was born of a prison mode of signaling sexual availability.,false,https://www.snopes.com/fact-check/sagging-pants/,,Risqué Business,,Snopes Staff,,Sagging Pants,15 April 2005,,['None'],train,the fashion of sagging one s pants was born of a prison mode of signaling sexual availability,['Risqué Business'],[],Risqué Business,,risqué business | ,16,www.snopes.com,True
abbc-00308,"The claim: Prime Minister Tony Abbott says the Coalition announced plans to stop new mothers ""double dipping"" on paid parental leave before the 2013 election.",in-between,http://www.abc.net.au/news/2015-05-15/double-dipping-parental-leave/6466068,"The claim: Prime Minister Tony Abbott says the Coalition announced plans to stop new mothers ""double dipping"" on paid parental leave before the 2013 election.","['budget', 'social-policy', 'australia']",,,"['budget', 'social-policy', 'australia']",Fact check: The Coalition's stance on paid parental leave 'double dipping',"Fri 15 May 2015, 1:47am",,"['Tony_Abbott', 'Coalition_(Australia)']",train,the claim prime minister tony abbott says the coalition announced plans to stop new mothers double dipping on paid parental leave before the 2013 election,"['budget', 'social-policy', 'australia']","['budget', 'social-policy', 'australia']",budget | social-policy | australia,budget | social-policy | australia,budget | social-policy | australia | budget | social-policy | australia,25,www.abc.net.au,True
vees-00486,"STATEMENT: Speaking before Luzon local chief executives on Oct. 4 during the Sulong Pilipinas Convention – Local Governance Series, Duterte said:",none,http://verafiles.org/articles/vera-files-fact-check-did-imee-fund-dutertes-campaign,"Documents obtained by VERA Files showed Marcos’ name does not appear among the 183 donors listed by Duterte and his party, Partido Demokratiko Pilipino-Lakas ng Bayan (PDP-Laban), in their Statements of Contributions and Expenditures (SOCE).",,,,"Duterte,2016 elections,Marcos,campaign contributions,campaign finance",VERA FILES FACT CHECK: Did Imee fund Duterte’s campaign?,"October 26, 2016",,['None'],train,statement speaking before luzon local chief executives on oct 4 during the sulong pilipinas convention local governance series duterte said,[],"['Duterte', '2016 elections', 'Marcos', 'campaign contributions', 'campaign finance']",,Duterte | 2016 elections | Marcos | campaign contributions | campaign finance, | duterte | 2016 elections | marcos | campaign contributions | campaign finance,21,verafiles.org,True
abbc-00034,"The claim: Assistant Treasurer Kelly O'Dwyer says that Australia's superannuation system ""was set up to be an alternative to the aged pension so that people didn't have to rely upon the aged pension or even the part pension"".",in-the-red,http://www.abc.net.au/news/2015-11-18/fact-check-was-super-designed-to-get-people-off-the-pension/6923582,"The claim: Assistant Treasurer Kelly O'Dwyer says that Australia's superannuation system ""was set up to be an alternative to the aged pension so that people didn't have to rely upon the aged pension or even the part pension"".","['superannuation', 'social-policy', 'government-and-politics', 'welfare', 'tax', 'liberals', 'australia']",,,"['superannuation', 'social-policy', 'government-and-politics', 'welfare', 'tax', 'liberals', 'australia']",Fact check: Was superannuation designed to get people off the pension?,"Thu 3 Mar 2016, 1:19am",,['Australia'],train,the claim assistant treasurer kelly o dwyer says that australia s superannuation system was set up to be an alternative to the aged pension so that people didn t have to rely upon the aged pension or even the part pension,"['superannuation', 'social-policy', 'government-and-politics', 'welfare', 'tax', 'liberals', 'australia']","['superannuation', 'social-policy', 'government-and-politics', 'welfare', 'tax', 'liberals', 'australia']",superannuation | social-policy | government-and-politics | welfare | tax | liberals | australia,superannuation | social-policy | government-and-politics | welfare | tax | liberals | australia,superannuation | social-policy | government-and-politics | welfare | tax | liberals | australia | superannuation | social-policy | government-and-politics | welfare | tax | liberals | australia,38,www.abc.net.au,True
tron-00577,"Disney Fired 250 Employees, Hired Foreign Replacements",truth!,https://www.truthorfiction.com/disney-fired-250-employees-hired-foreign-replacements/,,business,,,,"Disney Fired 250 Employees, Hired Foreign Replacements","Jun 10, 2015",,['None'],train,disney fired 250 employees hired foreign replacements,['business'],[],business,,business | ,7,www.truthorfiction.com,True
snes-02265,Uber increased its prices in parts of London around the time of a terror attack in June 2017,mixture,https://www.snopes.com/fact-check/uber-increase-london-attack/,,Business,,Dan MacGuill,,Did Uber Increase its Prices in London After a Terror Attack?,5 June 2017,,['London'],train,uber increased its prices in parts of london around the time of a terror attack in june 2017,['Business'],[],Business,,business | ,18,www.snopes.com,True
snes-05130,Cell phone companies began charging users for SMS emojis (emoticons) in February 2016.,mostly false,https://www.snopes.com/fact-check/emoji-charges-cell-phone/,,Business,,Kim LaCapria,,Cellular Companies Charging for Emojis?,2 March 2016,,['None'],train,cell phone companies began charging users for sms emojis emoticons in february 2016,['Business'],[],Business,,business | ,13,www.snopes.com,True
tron-01519,Congress Passes $42.4 Billion Consumer Rebate Program,misleading!,https://www.truthorfiction.com/congress-passes-42-4-billion-consumer-rebate-program/,,government,,,"['congress', 'scams', 'taxes']",Congress Passes $42.4 Billion Consumer Rebate Program,"Sep 6, 2016",,['None'],train,congress passes 42 4 billion consumer rebate program,['government'],"['congress', 'scams', 'taxes']",government,congress | scams | taxes,government | congress | scams | taxes,7,www.truthorfiction.com,True
snes-01610,Does Hobby Lobby Refuse to Sell Jewish Holiday Items?,outdated,https://www.snopes.com/fact-check/hobby-lobby-refuse-sell-jewish-holiday-items/,,Business,,David Emery,,Does Hobby Lobby Refuse to Sell Jewish Holiday Items?,9 October 2017,,['None'],train,does hobby lobby refuse to sell jewish holiday items,['Business'],[],Business,,business | ,9,www.snopes.com,True
snes-03454,"Protests could permanently halt the Dakota Access Pipeline by blocking construction until 1 January 2017, when the project's contracts expire.",mixture,https://www.snopes.com/fact-check/will-a-deadline-of-1-january-2017-kill-the-dakota-access-pipeline/,,Business,,Kim LaCapria,,Will a Deadline of 1 January 2017 Kill the Dakota Access Pipeline?,29 November 2016,,['None'],train,protests could permanently halt the dakota access pipeline by blocking construction until 1 january 2017 when the project s contracts expire,['Business'],[],Business,,business | ,20,www.snopes.com,True
abbc-00416,The claim: Rachel Siewert says China and the US would not allow a foreign government to buy 1 million hectares of land.,in-between,http://www.abc.net.au/news/2013-09-23/greens-foreign-ownership-claim-overstated/4965854,The claim: Rachel Siewert says China and the US would not allow a foreign government to buy 1 million hectares of land.,"['greens', 'federal-government', 'business-economics-and-finance', 'australia']",,,"['greens', 'federal-government', 'business-economics-and-finance', 'australia']",Greens Senator Rachel Siewert's foreign ownership claim overstated,"Thu 3 Oct 2013, 1:11am",,['China'],train,the claim rachel siewert says china and the us would not allow a foreign government to buy 1 million hectares of land,"['greens', 'federal-government', 'business-economics-and-finance', 'australia']","['greens', 'federal-government', 'business-economics-and-finance', 'australia']",greens | federal-government | business-economics-and-finance | australia,greens | federal-government | business-economics-and-finance | australia,greens | federal-government | business-economics-and-finance | australia | greens | federal-government | business-economics-and-finance | australia,22,www.abc.net.au,True
tron-00531,Charvat vs. Carnival: Class Action Lawsuit for Free Cruise Robocalls,truth!,https://www.truthorfiction.com/charvat-vs-carnival-free-cruise-robocalls/,,business,,,"['class action', 'robocalls']",Charvat vs. Carnival: Class Action Lawsuit for Free Cruise Robocalls,"Aug 18, 2017",,['None'],train,charvat vs carnival class action lawsuit for free cruise robocalls,['business'],"['class action', 'robocalls']",business,class action | robocalls,business | class action | robocalls,10,www.truthorfiction.com,True
tron-00536,"Walmart Jelly Sandals, Jelly Shoes Contain Lead",unproven!,https://www.truthorfiction.com/walmart-jelly-shoes-sandals-lead/,,business,,,"['facebook', 'walmart', 'warnings']","Walmart Jelly Sandals, Jelly Shoes Contain Lead","Jul 24, 2017",,['None'],train,walmart jelly sandals jelly shoes contain lead,['business'],"['facebook', 'walmart', 'warnings']",business,facebook | walmart | warnings,business | facebook | walmart | warnings,7,www.truthorfiction.com,True
vees-00085,VERA FILES FACT SHEET: Timeline of the 2019 budget deadlock,none,http://verafiles.org/articles/vera-files-fact-sheet-timeline-2019-budget-deadlock,,,,,"2019 budget,cash-based budgeting",VERA FILES FACT SHEET: Timeline of the 2019 budget deadlock,"August 29, 2018",,['None'],train,vera files fact sheet timeline of the 2019 budget deadlock,[],"['2019 budget', 'cash-based budgeting']",,2019 budget | cash-based budgeting, | 2019 budget | cash-based budgeting,10,verafiles.org,True
snes-00918,"Amazon's Alexa randomly plays a ""creepy laugh.""",mixture,https://www.snopes.com/fact-check/is-amazons-alexa-emitting-unprompted-creepy-laughing/,,Business,,Kim LaCapria,,Is Amazon’s Alexa Creepily Laughing for No Apparent Reason?,8 March 2018,,['None'],train,amazon s alexa randomly plays a creepy laugh,['Business'],[],Business,,business | ,7,www.snopes.com,True
vees-00281,VERA FILES FACT SHEET: Duterte complains about his salary and lack of allowance; here's why he can't just be given his ‘ideal’ P1M pay,none,http://verafiles.org/articles/vera-files-fact-sheet-duterte-complains-about-his-salary-and,,,,,"Duterte,Salary",VERA FILES FACT SHEET: Duterte complains about his salary and lack of allowance; here's why he can't just be given his ‘ideal’ P1M pay,"March 13, 2018",,['None'],train,vera files fact sheet duterte complains about his salary and lack of allowance here s why he can t just be given his ideal p1m pay,[],"['Duterte', 'Salary']",,Duterte | Salary, | duterte | salary,24,verafiles.org,True
para-00112,"Moving immediately to a floating carbon price would result in ""a black hole of up to $15 billion in the budget"".",mostly false,http://pandora.nla.gov.au//pan/140601/20131209-1141/www.politifact.com.au/truth-o-meter/statements/2013/jul/15/joe-hockey/early-ets-would-hurt-budget-how-much/index.html,,"['Budget', 'Carbon Tax', 'Economy']",Joe Hockey,"Peter Martin, Peter Fray",,An early ETS would hurt the budget - but by how much?,"Monday, July 15, 2013 at 8:06 a.m.",,['None'],train,moving immediately to a floating carbon price would result in a black hole of up to 15 billion in the budget,"['Budget', 'Carbon Tax', 'Economy']",[],Budget | Carbon Tax | Economy,,budget | carbon tax | economy | ,21,pandora.nla.gov.au,True
para-00122,"Despite the GFC, youth unemployment has been lower in the Rudd-Gillard Labor years than under John Howard.",mostly true,http://pandora.nla.gov.au//pan/140601/20131209-1141/www.politifact.com.au/truth-o-meter/statements/2013/jul/06/kate-ellis/GFC-Youth-Unemployment-lower-Labor-than-Howard/index.html,,['Employment'],Kate Ellis,"Su-Lin Tan, Peter Fray",,"Despite the GFC, youth unemployment has been lower in the Rudd-Gillard Labor years than under John Howard.","Saturday, July 6, 2013 at 11:15 a.m.",,['John_Howard'],train,despite the gfc youth unemployment has been lower in the rudd gillard labor years than under john howard,['Employment'],[],Employment,,employment | ,17,pandora.nla.gov.au,True
snes-00511,"In June 2018, Ivanka Trump adopted the alias ""Adrienne Vittadini"" to market her fashion line to unwitting buyers.",mostly false,https://www.snopes.com/fact-check/ivanka-trumps-line-rebranded-adrienne-vittadini/,,Business,,Kim LaCapria,,Has Ivanka Trump’s Line Been Rebranded as ‘Adrienne Vittadini’?,4 June 2018,,['None'],train,in june 2018 ivanka trump adopted the alias adrienne vittadini to market her fashion line to unwitting buyers,['Business'],[],Business,,business | ,18,www.snopes.com,True
tron-00551,PepsiCo CEO Indra Nooya Bashes Donald Trump,misleading!,https://www.truthorfiction.com/pepsico-ceo-indra-nooya-bashes-donald-trump/,,business,,,,PepsiCo CEO Indra Nooya Bashes Donald Trump,"Nov 15, 2016",,['None'],train,pepsico ceo indra nooya bashes donald trump,['business'],[],business,,business | ,7,www.truthorfiction.com,True
tron-00558,Target Stock Plummets After Millions Boycott,fiction!,https://www.truthorfiction.com/target-stock-plummets-millions-boycott/,,business,,,,Target Stock Plummets After Millions Boycott,"May 3, 2016",,['None'],train,target stock plummets after millions boycott,['business'],[],business,,business | ,6,www.truthorfiction.com,True
abbc-00159,The Coalition promised to hold a National Commission of Audit to examine reducing the size of government.,in-the-green,http://www.abc.net.au/news/2014-07-27/commission-of-audit-promise-check/5391392,,"['federal-government', 'budget', 'liberals', 'abbott-tony', 'australia']",,,"['federal-government', 'budget', 'liberals', 'abbott-tony', 'australia']",Promise check: Hold a National Commission of Audit,"Sun 8 May 2016, 7:37am",,['None'],train,the coalition promised to hold a national commission of audit to examine reducing the size of government,"['federal-government', 'budget', 'liberals', 'abbott-tony', 'australia']","['federal-government', 'budget', 'liberals', 'abbott-tony', 'australia']",federal-government | budget | liberals | abbott-tony | australia,federal-government | budget | liberals | abbott-tony | australia,federal-government | budget | liberals | abbott-tony | australia | federal-government | budget | liberals | abbott-tony | australia,17,www.abc.net.au,True
abbc-00421,"The claim: Kevin Rudd says car industry assistance is $18 per head per year in Australia, $90 in the United States and $96 in Germany.",in-between,http://www.abc.net.au/news/2013-09-06/kevin-rudd-takes-car-subsidy-figures-out-of-context/4932488,"The claim: Kevin Rudd says car industry assistance is $18 per head per year in Australia, $90 in the United States and $96 in Germany.","['rudd-kevin', 'federal-elections', 'business-economics-and-finance', 'manufacturing', 'federal-government', 'alp', 'australia']",,,"['rudd-kevin', 'federal-elections', 'business-economics-and-finance', 'manufacturing', 'federal-government', 'alp', 'australia']",Kevin Rudd takes car subsidy figures out of context,"Tue 11 Feb 2014, 2:47am",,"['United_States', 'Germany', 'Australia', 'Kevin_Rudd']",train,the claim kevin rudd says car industry assistance is 18 per head per year in australia 90 in the united states and 96 in germany,"['rudd-kevin', 'federal-elections', 'business-economics-and-finance', 'manufacturing', 'federal-government', 'alp', 'australia']","['rudd-kevin', 'federal-elections', 'business-economics-and-finance', 'manufacturing', 'federal-government', 'alp', 'australia']",rudd-kevin | federal-elections | business-economics-and-finance | manufacturing | federal-government | alp | australia,rudd-kevin | federal-elections | business-economics-and-finance | manufacturing | federal-government | alp | australia,rudd-kevin | federal-elections | business-economics-and-finance | manufacturing | federal-government | alp | australia | rudd-kevin | federal-elections | business-economics-and-finance | manufacturing | federal-government | alp | australia,25,www.abc.net.au,True
snes-03461,Michigan is about to sell 100 million gallons of groundwater to Nestlé for $200.,mixture,https://www.snopes.com/fact-check/michigan-is-about-to-sell-100-million-gallons-of-groundwater-to-nestle-for-200/,,Business,,Kim LaCapria,,Is Michigan About to Sell 100 Million Gallons of Groundwater to Nestlé for $200?,29 November 2016,,"['Michigan', 'Nestlé']",train,michigan is about to sell 100 million gallons of groundwater to nestlé for 200,['Business'],[],Business,,business | ,14,www.snopes.com,True
