claimID,claim,label,claimURL,reason,categories,speaker,checker,tags,article title,publish date,climate,entities,original_split,claim_normalised,categories_list,tags_list,category_text,tag_text,metadata_text,word_count,factcheck_domain,finance_metadata_match
abbc-00337,"The claim: Tony Abbott says India has an ""absolutely impeccable record"" when it comes to nuclear non-proliferation.",in-between,http://www.abc.net.au/news/2014-09-24/tony-abbott-india-uranium-record-fact-check/5736514,"The claim: Tony Abbott says India has an ""absolutely impeccable record"" when it comes to nuclear non-proliferation.","['uranium-mining', 'industry', 'business-economics-and-finance', 'world-politics', 'government-and-politics', 'federal-government', 'nuclear-issues', 'nuclear-energy', 'alternative-energy', 'environment', 'abbott-tony', 'liberals', 'australia', 'india']",,,"['uranium-mining', 'industry', 'business-economics-and-finance', 'world-politics', 'government-and-politics', 'federal-government', 'nuclear-issues', 'nuclear-energy', 'alternative-energy', 'environment', 'abbott-tony', 'liberals', 'australia', 'india']",Fact check: Tony Abbott exaggerating India's 'absolutely impeccable record' on nuclear non-proliferation,"Tue 23 Sep 2014, 11:00pm",,"['Tony_Abbott', 'India']",train,the claim tony abbott says india has an absolutely impeccable record when it comes to nuclear non proliferation,"['uranium-mining', 'industry', 'business-economics-and-finance', 'world-politics', 'government-and-politics', 'federal-government', 'nuclear-issues', 'nuclear-energy', 'alternative-energy', 'environment', 'abbott-tony', 'liberals', 'australia', 'india']","['uranium-mining', 'industry', 'business-economics-and-finance', 'world-politics', 'government-and-politics', 'federal-government', 'nuclear-issues', 'nuclear-energy', 'alternative-energy', 'environment', 'abbott-tony', 'liberals', 'australia', 'india']",uranium-mining | industry | business-economics-and-finance | world-politics | government-and-politics | federal-government | nuclear-issues | nuclear-energy | alternative-energy | environment | abbott-tony | liberals | australia | india,uranium-mining | industry | business-economics-and-finance | world-politics | government-and-politics | federal-government | nuclear-issues | nuclear-energy | alternative-energy | environment | abbott-tony | liberals | australia | india,uranium-mining | industry | business-economics-and-finance | world-politics | government-and-politics | federal-government | nuclear-issues | nuclear-energy | alternative-energy | environment | abbott-tony | liberals | australia | india | uranium-mining | industry | business-economics-and-finance | world-politics | government-and-politics | federal-government | nuclear-issues | nuclear-energy | alternative-energy | environment | abbott-tony | liberals | australia | india,17,www.abc.net.au,True
snes-06323,Payment of U.S. federal income taxes is voluntary.,false,https://www.snopes.com/fact-check/is-income-tax-voluntary/,,Business,,David Mikkelson,,Is Payment of Income Taxes Voluntary?,14 April 2010,,['United_States'],train,payment of u s federal income taxes is voluntary,['Business'],[],Business,,business | ,8,www.snopes.com,True
abbc-00042,The claim: Treasurer Joe Hockey and Prime Minister Tony Abbott say they need the agreement of the states and territories to remove the GST from tampons and pads.,in-the-red,http://www.abc.net.au/news/2015-05-27/how-does-scrapping-the-gst-on-tampons-work/6500774,The claim: Treasurer Joe Hockey and Prime Minister Tony Abbott say they need the agreement of the states and territories to remove the GST from tampons and pads.,"['government-and-politics', 'tax', 'abbott-tony', 'hockey-joe', 'liberals', 'states-and-territories', 'australia']",,,"['government-and-politics', 'tax', 'abbott-tony', 'hockey-joe', 'liberals', 'states-and-territories', 'australia']",Fact check: How can the GST on tampons be scrapped?,"Thu 3 Mar 2016, 1:42am",,"['Tony_Abbott', 'Joe_Hockey']",train,the claim treasurer joe hockey and prime minister tony abbott say they need the agreement of the states and territories to remove the gst from tampons and pads,"['government-and-politics', 'tax', 'abbott-tony', 'hockey-joe', 'liberals', 'states-and-territories', 'australia']","['government-and-politics', 'tax', 'abbott-tony', 'hockey-joe', 'liberals', 'states-and-territories', 'australia']",government-and-politics | tax | abbott-tony | hockey-joe | liberals | states-and-territories | australia,government-and-politics | tax | abbott-tony | hockey-joe | liberals | states-and-territories | australia,government-and-politics | tax | abbott-tony | hockey-joe | liberals | states-and-territories | australia | government-and-politics | tax | abbott-tony | hockey-joe | liberals | states-and-territories | australia,28,www.abc.net.au,True
abbc-00141,"The claim: New South Wales Premier Mike Baird says the average rate of GST across OECD nations is around 20 per cent, and Australia's GST is ""right down the bottom"".",in-the-green,http://www.abc.net.au/news/2015-07-30/fact-check-rate-of-gst/6650406,"The claim: New South Wales Premier Mike Baird says the average rate of GST across OECD nations is around 20 per cent, and Australia's GST is ""right down the bottom"".","['government-and-politics', 'tax', 'federal---state-issues', 'australia']",,,"['government-and-politics', 'tax', 'federal---state-issues', 'australia']",Fact check: Do Australians pay less GST than people in other OECD nations?,"Mon 3 Aug 2015, 2:23am",,"['Australia', 'New_South_Wales', 'Goods_and_Services_Tax_(Australia)']",train,the claim new south wales premier mike baird says the average rate of gst across oecd nations is around 20 per cent and australia s gst is right down the bottom,"['government-and-politics', 'tax', 'federal---state-issues', 'australia']","['government-and-politics', 'tax', 'federal---state-issues', 'australia']",government-and-politics | tax | federal---state-issues | australia,government-and-politics | tax | federal---state-issues | australia,government-and-politics | tax | federal---state-issues | australia | government-and-politics | tax | federal---state-issues | australia,30,www.abc.net.au,True
para-00106,Kevin Rudd’s carbon tax will cost the average household more than $3000 over the six years from mid-2014.,mostly true,http://pandora.nla.gov.au//pan/140601/20131209-1141/www.politifact.com.au/truth-o-meter/statements/2013/jul/18/greg-hunt/how-much-will-floating-carbon-price-cost-australia/index.html,,"['Carbon Tax', 'Economy', 'Environment']",Greg Hunt,"Michael Koziol, David Humphries",,How much will a floating carbon price cost Australian households?,"Thursday, July 18, 2013 at 3:21 p.m.",,['None'],train,kevin rudd s carbon tax will cost the average household more than 3000 over the six years from mid 2014,"['Carbon Tax', 'Economy', 'Environment']",[],Carbon Tax | Economy | Environment,,carbon tax | economy | environment | ,18,pandora.nla.gov.au,True
abbc-00377,"Liberal leader Tony Abbott said on May 9, 2013 that a Coalition government would ""end the frustration of Central Coast motorists and get the missing F3 to M2 link underway"".",in-between,http://www.abc.net.au/news/2014-07-27/405-million-for-northconnex-in-sydney/5576588,,"['road-transport', 'industry', 'business-economics-and-finance', 'abbott-tony', 'liberals', 'federal-government', 'sydney-2000', 'australia', 'nsw']",,,"['road-transport', 'industry', 'business-economics-and-finance', 'abbott-tony', 'liberals', 'federal-government', 'sydney-2000', 'australia', 'nsw']","Promise check: $405 million to get the ""missing motorway link"" in Sydney's north underway","Sun 8 May 2016, 7:37am",,"['Tony_Abbott', 'Coalition_(Australia)']",train,liberal leader tony abbott said on may 9 2013 that a coalition government would end the frustration of central coast motorists and get the missing f3 to m2 link underway,"['road-transport', 'industry', 'business-economics-and-finance', 'abbott-tony', 'liberals', 'federal-government', 'sydney-2000', 'australia', 'nsw']","['road-transport', 'industry', 'business-economics-and-finance', 'abbott-tony', 'liberals', 'federal-government', 'sydney-2000', 'australia', 'nsw']",road-transport | industry | business-economics-and-finance | abbott-tony | liberals | federal-government | sydney-2000 | australia | nsw,road-transport | industry | business-economics-and-finance | abbott-tony | liberals | federal-government | sydney-2000 | australia | nsw,road-transport | industry | business-economics-and-finance | abbott-tony | liberals | federal-government | sydney-2000 | australia | nsw | road-transport | industry | business-economics-and-finance | abbott-tony | liberals | federal-government | sydney-2000 | australia | nsw,30,www.abc.net.au,True
para-00141,Every illegal boat is costing you $12.8 million.,mostly true,http://pandora.nla.gov.au//pan/140601/20131209-1141/www.politifact.com.au/truth-o-meter/statements/2013/jun/25/liberal-party-australia/liberal-party-says-every-illegal-boat-costing-128-/index.html,,"['Asylum Seekers', 'Budget', 'Campaign ads', 'Immigration']",Liberal Party of Australia,"Chris Pash, Peter Fray, Su-Lin Tan",,"Liberal Party says every ""illegal boat"" is costing Australians $12.8 million","Tuesday, June 25, 2013 at 10:39 a.m.",,['None'],train,every illegal boat is costing you 12 8 million,"['Asylum Seekers', 'Budget', 'Campaign ads', 'Immigration']",[],Asylum Seekers | Budget | Campaign ads | Immigration,,asylum seekers | budget | campaign ads | immigration | ,8,pandora.nla.gov.au,True
para-00140,There are more Australians in work today than there have been at any time in our nation’s history.,half-true,http://pandora.nla.gov.au//pan/140601/20131209-1141/www.politifact.com.au/truth-o-meter/statements/2013/jun/25/stephen-jones/labor-says-more-people-are-full-time-jobs-now-ever/index.html,,"['Economy', 'Employment']",Stephen Jones,"Su-Lin Tan, David Humphries, Peter Fray",,Labor says more people are in full-time jobs now than ever before,"Tuesday, June 25, 2013 at 2:53 p.m.",,['None'],train,there are more australians in work today than there have been at any time in our nation s history,"['Economy', 'Employment']",[],Economy | Employment,,economy | employment | ,18,pandora.nla.gov.au,True
farg-00192,Described the estimated 2.6 percent growth in the nation’s real gross domestic product for the second quarter of 2017 as “a number that nobody thought they’d see for a long period of time.”,false,https://www.factcheck.org/2017/08/trumps-gdp-puffery/,,the-factcheck-wire,Donald Trump,Robert Farley,['economy'],Trump’s GDP Puffery,"August 1, 2017","[' Cabinet meeting at the White House – Monday, July 31, 2017 ']",['None'],train,described the estimated 2 6 percent growth in the nation s real gross domestic product for the second quarter of 2017 as a number that nobody thought they d see for a long period of time,['the-factcheck-wire'],['economy'],the-factcheck-wire,economy,the-factcheck-wire | economy,33,www.factcheck.org,True
tron-02692,The killer who uses a $5 bill to lure victims,fiction!,https://www.truthorfiction.com/cashkiller/,,money-financial,,,,The killer who uses a $5 bill to lure victims,"Mar 17, 2015",,['None'],train,the killer who uses a 5 bill to lure victims,['money-financial'],[],money-financial,,money-financial | ,10,www.truthorfiction.com,True
snes-01888,"As of August 2017, members of the public could potentially gain compensation as part of a class action lawsuit against major cruise companies.",true,https://www.snopes.com/fact-check/cruise-ship-lawsuit/,,Business,,Dan MacGuill,,Is There a Class Action Lawsuit for People Who Got Robocalls From Cruise Companies?,16 August 2017,,['None'],train,as of august 2017 members of the public could potentially gain compensation as part of a class action lawsuit against major cruise companies,['Business'],[],Business,,business | ,23,www.snopes.com,True
tron-00571,"Chipotle Uses Dog and Cat Meat, Will Close All Restaurants",fiction!,https://www.truthorfiction.com/chipotle-uses-dog-and-cat-meat-closing-all-restaurants/,,business,,,,"Chipotle Uses Dog and Cat Meat, Will Close All Restaurants","Nov 18, 2015",,['None'],train,chipotle uses dog and cat meat will close all restaurants,['business'],[],business,,business | ,10,www.truthorfiction.com,True
abbc-00190,The claim: Ged Kearney says wages in Australia have been at their lowest rate of growth in decades and labour productivity is the highest it's been in decades.,in-the-green,http://www.abc.net.au/news/2014-02-06/ged-kearney-wages-productivity-claim-overstated/5227450,The claim: Ged Kearney says wages in Australia have been at their lowest rate of growth in decades and labour productivity is the highest it's been in decades.,"['business-economics-and-finance', 'economic-trends', 'federal-government', 'unions', 'australia']",,,"['business-economics-and-finance', 'economic-trends', 'federal-government', 'unions', 'australia']","How fast are wages, productivity really growing in Australia?","Mon 3 Mar 2014, 12:05am",,['Australia'],train,the claim ged kearney says wages in australia have been at their lowest rate of growth in decades and labour productivity is the highest it s been in decades,"['business-economics-and-finance', 'economic-trends', 'federal-government', 'unions', 'australia']","['business-economics-and-finance', 'economic-trends', 'federal-government', 'unions', 'australia']",business-economics-and-finance | economic-trends | federal-government | unions | australia,business-economics-and-finance | economic-trends | federal-government | unions | australia,business-economics-and-finance | economic-trends | federal-government | unions | australia | business-economics-and-finance | economic-trends | federal-government | unions | australia,28,www.abc.net.au,True
vees-00066,"Asked about the 6.4 percent inflation rate in August, Panelo on Sept. 7 told CNN Philippines’ Cherie Mercado the figure is wrong and partly blamed the media. He said:",none,http://verafiles.org/articles/vera-files-fact-check-panelo-mixes-inflation-figures,"Panelo confused the year-on-year inflation rate which indeed surged 6.4 percent in August, with the 4.8 percent year-to-date inflation rate.",,,,"Panelo,inflation",VERA FILES FACT CHECK: Panelo mixes up inflation figures,"September 09, 2018",,['None'],train,asked about the 6 4 percent inflation rate in august panelo on sept 7 told cnn philippines cherie mercado the figure is wrong and partly blamed the media he said,[],"['Panelo', 'inflation']",,Panelo | inflation, | panelo | inflation,29,verafiles.org,True
snes-01322,Did Mia Khalifa 'Expose' Ajit Pai After He 'Slid Into Her DMs'?,false,https://www.snopes.com/fact-check/mia-khalifa-fcc-commissioner-dms/,,Risqué Business,,Dan Evon,,Did Mia Khalifa ‘Expose’ Ajit Pai After He ‘Slid Into Her DMs’?,18 December 2017,,['None'],train,did mia khalifa expose ajit pai after he slid into her dms,['Risqué Business'],[],Risqué Business,,risqué business | ,12,www.snopes.com,True
abbc-00166,"In 2011, the former Labor government introduced the ""Future of Financial Advice"" (FOFA) reforms after a series of financial collapses. Some in the financial planning industry suggested Labor's reforms went too far, adding costs and complexity to businesses which they then passed on to consumers.",in-the-green,http://www.abc.net.au/news/2014-07-27/future-of-financial-advice-reforms-promise-check/5566446,,"['consumer-finance', 'business-economics-and-finance', 'federal-government', 'liberals', 'australia']",,,"['consumer-finance', 'business-economics-and-finance', 'federal-government', 'liberals', 'australia']",Promise check: Amend Future of Financial Advice (FOFA) legislation,"Sun 8 May 2016, 7:37am",,['Australian_Labor_Party'],train,in 2011 the former labor government introduced the future of financial advice fofa reforms after a series of financial collapses some in the financial planning industry suggested labor s reforms went too far adding costs and complexity to businesses which they then passed on to consumers,"['consumer-finance', 'business-economics-and-finance', 'federal-government', 'liberals', 'australia']","['consumer-finance', 'business-economics-and-finance', 'federal-government', 'liberals', 'australia']",consumer-finance | business-economics-and-finance | federal-government | liberals | australia,consumer-finance | business-economics-and-finance | federal-government | liberals | australia,consumer-finance | business-economics-and-finance | federal-government | liberals | australia | consumer-finance | business-economics-and-finance | federal-government | liberals | australia,45,www.abc.net.au,True
snes-06052,The Canadian $2 bill (or $5 bill or $10 bill) depicts the U.S. flag flying over Parliament.,false,https://www.snopes.com/fact-check/red-ensign-scare/,,Business,,David Mikkelson,,U.S. Flag on Canadian Currency,6 June 2001,,"['United_States', 'Canada']",train,the canadian 2 bill or 5 bill or 10 bill depicts the u s flag flying over parliament,['Business'],[],Business,,business | ,17,www.snopes.com,True
para-00178,The budget papers reveal that Australia's gross debt will breach Labor's $300 billion debt ceiling within the forward estimates.,mostly false,http://pandora.nla.gov.au//pan/140601/20131209-1141/www.politifact.com.au/truth-o-meter/statements/2013/may/15/joe-hockey/does-budget-say-labor-will-breach-300-billion-debt/index.html,,"['Budget', 'Debt', 'Economy']",Joe Hockey,"David Humphries, Alix Piatek, Peter Fray",,Does the budget say Labor will breach the $300 billion debt ceiling?,"Wednesday, May 15, 2013 at 8:18 p.m.",,['Australia'],train,the budget papers reveal that australia s gross debt will breach labor s 300 billion debt ceiling within the forward estimates,"['Budget', 'Debt', 'Economy']",[],Budget | Debt | Economy,,budget | debt | economy | ,19,pandora.nla.gov.au,True
abbc-00118,"In a blistering response to the 2018 federal budget, charity group World Vision slammed the Federal Government for ""continuing Australia's darkest era of aid cuts and further letting down the world's most vulnerable"".",in-the-green,http://www.abc.net.au/news/2018-05-25/fact-check-has-foreign-aid-budget-been-cut-five-years-running/9783098,"Ms Anderson's claim is correct. Across the five financial years from 2014-15 to 2018-19, the aid budget has been cut twice in nominal terms. And while data from the Department of Foreign Affairs and Trade shows that nominal aid spending increased marginally in the other three budget years, these gains disappear after inflation is taken into account. This equates to a real cut in all five budget years. Experts told Fact Check that the Consumer Price Index was a reasonable way to measure inflation in the context of Australian aid spending. Based on this, Fact Check calculates that, from year to year, aid spending was cut in real terms by as little as 0.2 per cent and by as much as 17.7 per cent. According to ANU's Development Policy Centre, which publishes the aid figures in 2018 dollars, this equates to an $8 million cut in 2018-19 and a $953 million cut in 2015-16.","['government-and-politics', 'budget', 'foreign-affairs', 'foreign-aid', 'australia']",,,"['government-and-politics', 'budget', 'foreign-affairs', 'foreign-aid', 'australia']",Fact check: Has the foreign aid budget been cut five years in a row?,"Thu 12 Jul 2018, 2:41am",,['Australia'],train,in a blistering response to the 2018 federal budget charity group world vision slammed the federal government for continuing australia s darkest era of aid cuts and further letting down the world s most vulnerable,"['government-and-politics', 'budget', 'foreign-affairs', 'foreign-aid', 'australia']","['government-and-politics', 'budget', 'foreign-affairs', 'foreign-aid', 'australia']",government-and-politics | budget | foreign-affairs | foreign-aid | australia,government-and-politics | budget | foreign-affairs | foreign-aid | australia,government-and-politics | budget | foreign-affairs | foreign-aid | australia | government-and-politics | budget | foreign-affairs | foreign-aid | australia,33,www.abc.net.au,True
snes-01686,A Harvard study proved that Apple purposely slows down its older model iPhones to coincide with device releases and to boost sales of new models.,mixture,https://www.snopes.com/fact-check/harvard-study-apple-iphones-sales-slows/,,Business,,Kim LaCapria,,Did a Harvard Study Prove That Apple Slows Down iPhones to Boost Sales of New Ones?,22 September 2017,,"['Apple_Inc.', 'Harvard_University']",train,a harvard study proved that apple purposely slows down its older model iphones to coincide with device releases and to boost sales of new models,['Business'],[],Business,,business | ,25,www.snopes.com,True
abbc-00157,The claim: Mathias Cormann says Labor is opposing $5 billion in savings that it initiated when it was in government.,in-the-green,http://www.abc.net.au/news/2014-08-28/labor-blocking-five-billion-of-own-savings-measures/5684750,The claim: Mathias Cormann says Labor is opposing $5 billion in savings that it initiated when it was in government.,"['federal-government', 'budget', 'education', 'business-economics-and-finance', 'tax', 'liberals', 'government-and-politics', 'australia']",,,"['federal-government', 'budget', 'education', 'business-economics-and-finance', 'tax', 'liberals', 'government-and-politics', 'australia']",Fact check: Labor blocking $5 billion of its own savings measures,"Thu 28 Aug 2014, 5:18am",,['None'],train,the claim mathias cormann says labor is opposing 5 billion in savings that it initiated when it was in government,"['federal-government', 'budget', 'education', 'business-economics-and-finance', 'tax', 'liberals', 'government-and-politics', 'australia']","['federal-government', 'budget', 'education', 'business-economics-and-finance', 'tax', 'liberals', 'government-and-politics', 'australia']",federal-government | budget | education | business-economics-and-finance | tax | liberals | government-and-politics | australia,federal-government | budget | education | business-economics-and-finance | tax | liberals | government-and-politics | australia,federal-government | budget | education | business-economics-and-finance | tax | liberals | government-and-politics | australia | federal-government | budget | education | business-economics-and-finance | tax | liberals | government-and-politics | australia,20,www.abc.net.au,True
tron-00546,Cheerios Mailing Free Seeds to Save Birds,truth! & outdated!,https://www.truthorfiction.com/cheerios-mailing-free-seeds/,,business,,,"['environment', 'promotion']",Cheerios Mailing Free Seeds to Save Birds,"Mar 16, 2017",,['None'],train,cheerios mailing free seeds to save birds,['business'],"['environment', 'promotion']",business,environment | promotion,business | environment | promotion,7,www.truthorfiction.com,True
abbc-00085,"As Tasmania's March 15 election nears, the Government and Opposition are ramping up their rhetoric on jobs.",in-the-red,http://www.abc.net.au/news/2014-03-03/jobs-and-unemployment-whats-the-real-story-in-tasmania/5275438,,"['work', 'unemployment', 'federal---state-issues', 'states-and-territories', 'alp', 'greens', 'liberals', 'tas', 'australia', 'hobart-7000']",,,"['work', 'unemployment', 'federal---state-issues', 'states-and-territories', 'alp', 'greens', 'liberals', 'tas', 'australia', 'hobart-7000']",Jobs and unemployment: What's the real story in Tasmania?,"Thu 3 Apr 2014, 9:02am",,['None'],train,as tasmania s march 15 election nears the government and opposition are ramping up their rhetoric on jobs,"['work', 'unemployment', 'federal---state-issues', 'states-and-territories', 'alp', 'greens', 'liberals', 'tas', 'australia', 'hobart-7000']","['work', 'unemployment', 'federal---state-issues', 'states-and-territories', 'alp', 'greens', 'liberals', 'tas', 'australia', 'hobart-7000']",work | unemployment | federal---state-issues | states-and-territories | alp | greens | liberals | tas | australia | hobart-7000,work | unemployment | federal---state-issues | states-and-territories | alp | greens | liberals | tas | australia | hobart-7000,work | unemployment | federal---state-issues | states-and-territories | alp | greens | liberals | tas | australia | hobart-7000 | work | unemployment | federal---state-issues | states-and-territories | alp | greens | liberals | tas | australia | hobart-7000,17,www.abc.net.au,True
snes-02293,A lawyer received a caustic response after complaining to the Cleveland Browns about fans' throwing paper airplanes during the team's home NFL games.,true,https://www.snopes.com/fact-check/cleveland-browns-letters/,,Business,,David Mikkelson,,Letter Exchange Between Law Firm and Cleveland Browns,19 January 2011,,"['Cleveland_Browns', 'National_Football_League']",train,a lawyer received a caustic response after complaining to the cleveland browns about fans throwing paper airplanes during the team s home nfl games,['Business'],[],Business,,business | ,23,www.snopes.com,True
farg-00144,"The Republican tax plan in Congress ""is going to cost me a fortune"" in higher taxes.",none,https://www.factcheck.org/2017/11/trump-likely-benefits-tax-bills/,,the-factcheck-wire,Donald Trump,Lori Robertson,['Taxes'],Trump Likely Benefits from Tax Bills,"November 30, 2017","[' Speech in Missouri – Wednesday, November 29, 2017 ']","['United_States_Congress', 'Republican_Party_(United_States)']",train,the republican tax plan in congress is going to cost me a fortune in higher taxes,['the-factcheck-wire'],['Taxes'],the-factcheck-wire,Taxes,the-factcheck-wire | taxes,16,www.factcheck.org,True
