claimID,claim,label,claimURL,reason,categories,speaker,checker,tags,article title,publish date,climate,entities,original_split,claim_normalised,categories_list,tags_list,category_text,tag_text,metadata_text,word_count,factcheck_domain,finance_metadata_match
snes-05436,"McDonald's is getting rid of its ""Dollar Menu"" come 2016.",mostly false,https://www.snopes.com/fact-check/mcdonalds-getting-rid-dollar-menu/,,Business,,Kim LaCapria,,McDonald’s Getting Rid of the Dollar Menu?,29 December 2015,,['None'],train,mcdonald s is getting rid of its dollar menu come 2016,['Business'],[],Business,,business | ,10,www.snopes.com,True
snes-06041,A Huntley and Palmers biscuit tin included risqué images on its lid.,true,https://www.snopes.com/fact-check/cookie-nookie/,,Business,,David Mikkelson,,Risqué Images on Biscuit Tin,17 January 2009,,['None'],train,a huntley and palmers biscuit tin included risqué images on its lid,['Business'],[],Business,,business | ,12,www.snopes.com,True
tron-02685,Obama’s tax proposals,mostly fiction!,https://www.truthorfiction.com/taxes-election/,,money-financial,,,,Obama’s tax proposals,"Mar 17, 2015",,['None'],train,obama s tax proposals,['money-financial'],[],money-financial,,money-financial | ,3,www.truthorfiction.com,True
para-00013,"Let’s face it, we’ve had the five biggest deficits in Australian history from Wayne Swan’s five budgets.",mostly false,http://pandora.nla.gov.au//pan/140601/20131209-1141/www.politifact.com.au/truth-o-meter/statements/2013/oct/23/tony-abbott/abbott-says-swan-delivered-five-biggest-deficits-e/index.html,,"['Budget', 'Debt', 'Economy']",Tony Abbott,"Michael Koziol, Peter Fray",,Abbott says Wayne Swan delivered five biggest deficits ever,"Wednesday, October 23, 2013 at 8:18 p.m.",,['Australia'],train,let s face it we ve had the five biggest deficits in australian history from wayne swan s five budgets,"['Budget', 'Debt', 'Economy']",[],Budget | Debt | Economy,,budget | debt | economy | ,17,pandora.nla.gov.au,True
snes-06360,"AriZona changed its ""Southern Style Sweet Tea"" label after consumers complained that it depicted offensive images.",true,https://www.snopes.com/fact-check/label-unable/,,Business,,David Mikkelson,,AriZona Sweet Tea Label,25 March 2008,,['None'],train,arizona changed its southern style sweet tea label after consumers complained that it depicted offensive images,['Business'],[],Business,,business | ,16,www.snopes.com,True
abbc-00328,The claim: Andrew McKellar says the average motorist will pay somewhere in the region of $140 extra a year with an increase in the fuel tax excise from November 10.,in-between,http://www.abc.net.au/news/2014-11-10/cost-of-the-fuel-tax-indexation-exaggerated-fact-check/5853830,The claim: Andrew McKellar says the average motorist will pay somewhere in the region of $140 extra a year with an increase in the fuel tax excise from November 10.,"['tax', 'government-and-politics', 'business-economics-and-finance', 'federal-government', 'liberals', 'australia']",,,"['tax', 'government-and-politics', 'business-economics-and-finance', 'federal-government', 'liberals', 'australia']",Fact check: How much will the fuel tax hike leave you out of pocket?,"Sun 8 May 2016, 8:08am",,['None'],train,the claim andrew mckellar says the average motorist will pay somewhere in the region of 140 extra a year with an increase in the fuel tax excise from november 10,"['tax', 'government-and-politics', 'business-economics-and-finance', 'federal-government', 'liberals', 'australia']","['tax', 'government-and-politics', 'business-economics-and-finance', 'federal-government', 'liberals', 'australia']",tax | government-and-politics | business-economics-and-finance | federal-government | liberals | australia,tax | government-and-politics | business-economics-and-finance | federal-government | liberals | australia,tax | government-and-politics | business-economics-and-finance | federal-government | liberals | australia | tax | government-and-politics | business-economics-and-finance | federal-government | liberals | australia,30,www.abc.net.au,True
para-00117,"The Labor government is ""already a lower taxing government"" than the previous Coalition government.",mostly true,http://pandora.nla.gov.au//pan/140601/20131209-1141/www.politifact.com.au/truth-o-meter/statements/2013/jul/10/penny-wong/labor-taxes-lower-costellos/index.html,,"['Economy', 'Tax']",Penny Wong,"Alix Piatek, David Humphries",,We're lower taxing than Howard and Costello: Wong,"Wednesday, July 10, 2013 at 11:22 a.m.",,"['Coalition_(Australia)', 'Australian_Labor_Party']",train,the labor government is already a lower taxing government than the previous coalition government,"['Economy', 'Tax']",[],Economy | Tax,,economy | tax | ,14,pandora.nla.gov.au,True
snes-05724,'Secret lists' reveal price tag coding at Target and Costco stores.,mixture,https://www.snopes.com/fact-check/big-store-price-codes/,,Business,,David Mikkelson,,Big Store Price Codes,8 January 2014,,"['Costco', 'Target_Corporation']",train,secret lists reveal price tag coding at target and costco stores,['Business'],[],Business,,business | ,11,www.snopes.com,True
para-00059,"Labor website is ""a snapshot of the cuts we know Tony Abbott plans to make should he be elected"".",mostly false,http://pandora.nla.gov.au//pan/140601/20131209-1141/www.politifact.com.au/truth-o-meter/statements/2013/aug/23/penny-wong/cuts-costs-and-con-jobs-another-day-election-2013/index.html,,"['Campaign ads', 'Cost of living', 'Economy', 'Education', 'Employment', 'Health', 'Industrial relations']",Penny Wong,"Peter Martin, Peter Fray",,"Cuts, costs and con-jobs: another day in election 2013","Friday, August 23, 2013 at 12:54 p.m.",,['Tony_Abbott'],train,labor website is a snapshot of the cuts we know tony abbott plans to make should he be elected,"['Campaign ads', 'Cost of living', 'Economy', 'Education', 'Employment', 'Health', 'Industrial relations']",[],Campaign ads | Cost of living | Economy | Education | Employment | Health | Industrial relations,,campaign ads | cost of living | economy | education | employment | health | industrial relations | ,19,pandora.nla.gov.au,True
snes-00680,"A Kentucky business owner found out he had been paying the electric bills of an Ohio River bridge, in addition to his own, for five months.",true,https://www.snopes.com/fact-check/pay-bridge-electrical-bill/,,Business,,Alex Kasprak,,Did a Man Discover He Was Paying a Bridge’s Electric Bill?,1 May 2018,,"['Ohio_River', 'Kentucky']",train,a kentucky business owner found out he had been paying the electric bills of an ohio river bridge in addition to his own for five months,['Business'],[],Business,,business | ,26,www.snopes.com,True
farg-00382,“VP Mike Pence Busted Stealing Campaign Funds To Pay His Mortgage.”,misleading,https://www.factcheck.org/2018/09/partisan-site-revives-old-pence-controversy/,,fake-news,FactCheck.org,Saranac Hale Spencer,['campaign finance'],Partisan Site Revives Old Pence Controversy,"September 7, 2018",2018-09-07 23:02:53 UTC,['None'],train,vp mike pence busted stealing campaign funds to pay his mortgage,['fake-news'],['campaign finance'],fake-news,campaign finance,fake-news | campaign finance,11,www.factcheck.org,True
abbc-00318,"The claim: Joe Hockey has warned that Australia is at a ""tipping point"" and living beyond its means. ""We cannot continue to go on borrowing $100 million a day as a government just to pay our daily bills,"" he said.",in-between,http://www.abc.net.au/news/2015-02-13/hockey-100-million/6085378,"The claim: Joe Hockey has warned that Australia is at a ""tipping point"" and living beyond its means. ""We cannot continue to go on borrowing $100 million a day as a government just to pay our daily bills,"" he said.","['federal-government', 'budget', 'liberals', 'australia']",,,"['federal-government', 'budget', 'liberals', 'australia']",Fact check: Hockey over-eggs 'borrowing $100 million a day' claim,"Thu 3 Mar 2016, 6:01am",,['None'],train,the claim joe hockey has warned that australia is at a tipping point and living beyond its means we cannot continue to go on borrowing 100 million a day as a government just to pay our daily bills he said,"['federal-government', 'budget', 'liberals', 'australia']","['federal-government', 'budget', 'liberals', 'australia']",federal-government | budget | liberals | australia,federal-government | budget | liberals | australia,federal-government | budget | liberals | australia | federal-government | budget | liberals | australia,40,www.abc.net.au,True
abbc-00393,"The claim: Joe Hockey says within six years Australia will have ""the biggest medical research endowment fund in the world"".",in-between,http://www.abc.net.au/news/2014-05-21/will-australia-have-the-biggest-medical-research-fund/5454810,"The claim: Joe Hockey says within six years Australia will have ""the biggest medical research endowment fund in the world"".","['medical-research', 'health', 'doctors-and-medical-professionals', 'liberals', 'government-and-politics', 'budget', 'hockey-joe', 'australia']",,,"['medical-research', 'health', 'doctors-and-medical-professionals', 'liberals', 'government-and-politics', 'budget', 'hockey-joe', 'australia']",Will Australia's new medical research fund be the biggest in the world?,"Wed 21 May 2014, 3:05am",,['None'],train,the claim joe hockey says within six years australia will have the biggest medical research endowment fund in the world,"['medical-research', 'health', 'doctors-and-medical-professionals', 'liberals', 'government-and-politics', 'budget', 'hockey-joe', 'australia']","['medical-research', 'health', 'doctors-and-medical-professionals', 'liberals', 'government-and-politics', 'budget', 'hockey-joe', 'australia']",medical-research | health | doctors-and-medical-professionals | liberals | government-and-politics | budget | hockey-joe | australia,medical-research | health | doctors-and-medical-professionals | liberals | government-and-politics | budget | hockey-joe | australia,medical-research | health | doctors-and-medical-professionals | liberals | government-and-politics | budget | hockey-joe | australia | medical-research | health | doctors-and-medical-professionals | liberals | government-and-politics | budget | hockey-joe | australia,20,www.abc.net.au,True
abbc-00283,A panel of experts has agreed to advise ABC Fact Check for its work on economic issues.,in-between,http://www.abc.net.au/news/2016-02-18/fact-check-were-300000-jobs-created-in-2015/7135894,A panel of experts has agreed to advise ABC Fact Check for its work on economic issues.,"['unemployment', 'economic-trends', 'turnbull-malcolm', 'liberals', 'australia']",,,"['unemployment', 'economic-trends', 'turnbull-malcolm', 'liberals', 'australia']","Fact check: Were 301,000 jobs created in 2015?","Thu 3 Mar 2016, 1:14am",,['None'],train,a panel of experts has agreed to advise abc fact check for its work on economic issues,"['unemployment', 'economic-trends', 'turnbull-malcolm', 'liberals', 'australia']","['unemployment', 'economic-trends', 'turnbull-malcolm', 'liberals', 'australia']",unemployment | economic-trends | turnbull-malcolm | liberals | australia,unemployment | economic-trends | turnbull-malcolm | liberals | australia,unemployment | economic-trends | turnbull-malcolm | liberals | australia | unemployment | economic-trends | turnbull-malcolm | liberals | australia,17,www.abc.net.au,True
snes-02006,"Walmart has been adding a ""phantom charge"" of $10 to shoppers' bills for 10 years.",false,https://www.snopes.com/fact-check/walmart-jajket/,,Business,,Kim LaCapria,,"If You See This on a Walmart Receipt, Call the Police?",26 July 2017,,['None'],train,walmart has been adding a phantom charge of 10 to shoppers bills for 10 years,['Business'],[],Business,,business | ,15,www.snopes.com,True
tron-01502,President Trump Announces $612 Stimulus Checks,fiction!,https://www.truthorfiction.com/donald-trump-612-checks/,,government,,,"['donald trump', 'presidencies', 'taxes']",President Trump Announces $612 Stimulus Checks,"Feb 15, 2017",,['None'],train,president trump announces 612 stimulus checks,['government'],"['donald trump', 'presidencies', 'taxes']",government,donald trump | presidencies | taxes,government | donald trump | presidencies | taxes,6,www.truthorfiction.com,True
snes-04819,Target's stock price has plummeted due to a boycott over the store's transgender restroom policy.,mixture,https://www.snopes.com/fact-check/target-stock-boycott/,,Business,,Dan Evon,,Target Stock Plummets After One Million People Boycott Stores?,3 May 2016,,['None'],train,target s stock price has plummeted due to a boycott over the store s transgender restroom policy,['Business'],[],Business,,business | ,15,www.snopes.com,True
para-00136,"The 960,000 jobs added under Labor are ""a result of the actions of this government"".",half-true,http://pandora.nla.gov.au//pan/140601/20131209-1141/www.politifact.com.au/truth-o-meter/statements/2013/jun/26/wayne-swan/Jobs-created-result-Labor-actions/index.html,,['Economy'],Wayne Swan,"David Humphries, Su-Lin Tan, Peter Fray",,"The 960,000 jobs added under Labor are ""a result of the actions of this government"".","Wednesday, June 26, 2013 at 6:06 p.m.",,['None'],train,the 960 000 jobs added under labor are a result of the actions of this government,['Economy'],[],Economy,,economy | ,15,pandora.nla.gov.au,True
tron-00566,"Saudi Billionaire Buys Buford, Wyoming, to Build Mecca",fiction!,https://www.truthorfiction.com/saudi-billionaire-buys-buford-wyoming-to-build-mecca/,,business,,,,"Saudi Billionaire Buys Buford, Wyoming, to Build Mecca","Jan 27, 2016",,"['Wyoming', 'Saudi_Arabia']",train,saudi billionaire buys buford wyoming to build mecca,['business'],[],business,,business | ,8,www.truthorfiction.com,True
snes-05948,Monster brand energy drink uses a Hebrew version of 666 in their logo.,false,https://www.snopes.com/fact-check/monster-energy-drink-666/,,Business,,David Mikkelson,,Does the Monster Energy Drink Logo Include the Number 666?,10 November 2014,,['None'],train,monster brand energy drink uses a hebrew version of 666 in their logo,['Business'],[],Business,,business | ,13,www.snopes.com,True
abbc-00160,"An Emissions Reduction Fund is the centrepiece of the Coalition's ""direct action plan"" to address climate change.",in-the-green,http://www.abc.net.au/news/2014-07-27/emissions-reduction-fund-promise-check/5430108,,"['emissions-trading', 'business-economics-and-finance', 'federal-government', 'liberals', 'australia']",,,"['emissions-trading', 'business-economics-and-finance', 'federal-government', 'liberals', 'australia']",Promise check: Allocate $1.55 billion over first three years to establish an Emissions Reduction Fund,"Sun 8 May 2016, 7:37am",,['None'],train,an emissions reduction fund is the centrepiece of the coalition s direct action plan to address climate change,"['emissions-trading', 'business-economics-and-finance', 'federal-government', 'liberals', 'australia']","['emissions-trading', 'business-economics-and-finance', 'federal-government', 'liberals', 'australia']",emissions-trading | business-economics-and-finance | federal-government | liberals | australia,emissions-trading | business-economics-and-finance | federal-government | liberals | australia,emissions-trading | business-economics-and-finance | federal-government | liberals | australia | emissions-trading | business-economics-and-finance | federal-government | liberals | australia,17,www.abc.net.au,True
para-00129,[From July 1] Labor’s carbon tax goes up by 5 per cent.,mostly true,http://pandora.nla.gov.au//pan/140601/20131209-1141/www.politifact.com.au/truth-o-meter/statements/2013/jul/01/joe-hockey/hockey-says-carbon-price-goes-5-cent-today/index.html,,['Carbon Tax'],Joe Hockey,"Ellie Harvey, Peter Fray",,Hockey says the carbon price goes up 5 per cent today,"Monday, July 1, 2013 at 1:20 p.m.",,['None'],train,from july 1 labor s carbon tax goes up by 5 per cent,['Carbon Tax'],[],Carbon Tax,,carbon tax | ,12,pandora.nla.gov.au,True
abbc-00296,"The claim: Sex Discrimination Commissioner Elizabeth Broderick says fewer big Australian companies are run by women than by men named Peter and companies run by men named Peter, Michael, David or Andrew outnumber those run by women four to one.",in-between,http://www.abc.net.au/news/2015-10-09/fact-check-women-running-big-companies/6783082,"The claim: Sex Discrimination Commissioner Elizabeth Broderick says fewer big Australian companies are run by women than by men named Peter and companies run by men named Peter, Michael, David or Andrew outnumber those run by women four to one.","['business-economics-and-finance', 'australia']",,,"['business-economics-and-finance', 'australia']","Fact check: Do big companies run by a Peter, a Michael, a David or an Andrew outnumber those run by women four to one?","Thu 3 Mar 2016, 5:52am",,['Australia'],train,the claim sex discrimination commissioner elizabeth broderick says fewer big australian companies are run by women than by men named peter and companies run by men named peter michael david or andrew outnumber those run by women four to one,"['business-economics-and-finance', 'australia']","['business-economics-and-finance', 'australia']",business-economics-and-finance | australia,business-economics-and-finance | australia,business-economics-and-finance | australia | business-economics-and-finance | australia,40,www.abc.net.au,True
tron-02690,Scam to get your credit card number,scam!,https://www.truthorfiction.com/pornmail/,,money-financial,,,,Scam to get your credit card number,"Mar 17, 2015",,['None'],train,scam to get your credit card number,['money-financial'],[],money-financial,,money-financial | ,7,www.truthorfiction.com,True
para-00212,"The Coalition’s parental leave scheme is ""fully funded - by abolishing the existing scheme, and importantly by imposing the 1.5 per cent levy on the largest businesses.""",half-true,http://pandora.nla.gov.au//pan/140601/20131209-1141/www.politifact.com.au/truth-o-meter/statements/2013/aug/21/joe-hockey/Fully-funded-PPL-we-like-to-see-numbers/index.html,,"['Child Care', 'Parental Leave', 'Tax']",Joe Hockey,"Peter Martin, Peter Fray",,Fully-funded PPL: we'd like to see the costings,"Wednesday, August 21, 2013 at 3:54 p.m.",,['None'],train,the coalition s parental leave scheme is fully funded by abolishing the existing scheme and importantly by imposing the 1 5 per cent levy on the largest businesses,"['Child Care', 'Parental Leave', 'Tax']",[],Child Care | Parental Leave | Tax,,child care | parental leave | tax | ,27,pandora.nla.gov.au,True
para-00052,Says the Coalition’s $22 billion paid parental leave scheme costs more than the Commonwealth spends on childcare or the NBN every year.,half-true,http://pandora.nla.gov.au//pan/140601/20131209-1141/www.politifact.com.au/truth-o-meter/statements/2013/aug/26/kevin-rudd/childcare-versus-paid-parental-leave-which-would-c/index.html,,"['Budget', 'Parental Leave']",Kevin Rudd,"Michael Koziol, Peter Fray",,Childcare versus paid parental leave - which would cost more?,"Monday, August 26, 2013 at 10:46 p.m.",,['Commonwealth_of_Nations'],train,says the coalition s 22 billion paid parental leave scheme costs more than the commonwealth spends on childcare or the nbn every year,"['Budget', 'Parental Leave']",[],Budget | Parental Leave,,budget | parental leave | ,22,pandora.nla.gov.au,True
tron-00535,"Phantom “JAJKET” Item Shows Up on Walmart Receipts, Shoppers Charged $10",investigation pending!,https://www.truthorfiction.com/walmart-jajket-receipt/,,business,,,"['scams', 'walmart', 'warnings']","Phantom “JAJKET” Item Shows Up on Walmart Receipts, Shoppers Charged $10","Jul 25, 2017",,['None'],train,phantom jajket item shows up on walmart receipts shoppers charged 10,['business'],"['scams', 'walmart', 'warnings']",business,scams | walmart | warnings,business | scams | walmart | warnings,11,www.truthorfiction.com,True
abbc-00113,The claim: Michelle Rowland says the Coalition has not submitted any policies for costing to the Parliamentary Budget Office.,in-the-red,http://www.abc.net.au/news/2013-08-14/michelle-rowland-incorrect-coalition-costings/4865274,The claim: Michelle Rowland says the Coalition has not submitted any policies for costing to the Parliamentary Budget Office.,"['federal-government', 'federal-elections', 'budget', 'australia']",,,"['federal-government', 'federal-elections', 'budget', 'australia']",Labor MP Michelle Rowland incorrect on the Coalition's policy costings,"Tue 13 Aug 2013, 4:13pm",,['Coalition_(Australia)'],train,the claim michelle rowland says the coalition has not submitted any policies for costing to the parliamentary budget office,"['federal-government', 'federal-elections', 'budget', 'australia']","['federal-government', 'federal-elections', 'budget', 'australia']",federal-government | federal-elections | budget | australia,federal-government | federal-elections | budget | australia,federal-government | federal-elections | budget | australia | federal-government | federal-elections | budget | australia,19,www.abc.net.au,True
abbc-00329,"The Coalition's workplace relations plan was the second of its formal election policies to be launched, four months before the federal election.",in-between,http://www.abc.net.au/news/2014-11-07/no-cuts-to-penalty-rates-promise-check/5695272,,"['work', 'community-and-society', 'federal-government', 'small-business', 'business-economics-and-finance', 'liberals', 'australia']",,,"['work', 'community-and-society', 'federal-government', 'small-business', 'business-economics-and-finance', 'liberals', 'australia']",Promise check: No cuts to penalty rates,"Sun 8 May 2016, 8:08am",,['Coalition_(Australia)'],train,the coalition s workplace relations plan was the second of its formal election policies to be launched four months before the federal election,"['work', 'community-and-society', 'federal-government', 'small-business', 'business-economics-and-finance', 'liberals', 'australia']","['work', 'community-and-society', 'federal-government', 'small-business', 'business-economics-and-finance', 'liberals', 'australia']",work | community-and-society | federal-government | small-business | business-economics-and-finance | liberals | australia,work | community-and-society | federal-government | small-business | business-economics-and-finance | liberals | australia,work | community-and-society | federal-government | small-business | business-economics-and-finance | liberals | australia | work | community-and-society | federal-government | small-business | business-economics-and-finance | liberals | australia,22,www.abc.net.au,True
farg-00065,"“The average American worker today, despite the strong economy, is not getting ahead.”",misleading,https://www.factcheck.org/2018/06/sanders-misleading-wage-claim/,,the-factcheck-wire,FactCheck.org,Brooks Jackson,['real wages'],Sanders’ Misleading Wage Claim,"June 11, 2018",2018-06-11 21:11:27 UTC,['United_States'],train,the average american worker today despite the strong economy is not getting ahead,['the-factcheck-wire'],['real wages'],the-factcheck-wire,real wages,the-factcheck-wire | real wages,13,www.factcheck.org,True
fani-00007,CLAIM: “City Deals” by the UK Government are part of the Democratic Unionist Party’s Confidence and Supply Agreement with the Conservative Party.,conclusion: unclear,https://factcheckni.org/facts/were-city-deals-part-of-dups-confidence-and-supply-agreement/,,economy,,,,Were “City Deals” part of DUP’s Confidence and Supply Agreement?,,,['None'],train,claim city deals by the uk government are part of the democratic unionist party s confidence and supply agreement with the conservative party,['economy'],[],economy,,economy | ,22,factcheckni.org,True
tron-00575,Dunkin’ Donuts is Closing Down,fiction!,https://www.truthorfiction.com/dunkin-donuts-is-closing-down/,,business,,,,Dunkin’ Donuts is Closing Down,"Sep 17, 2015",,['None'],train,dunkin donuts is closing down,['business'],[],business,,business | ,5,www.truthorfiction.com,True
para-00048,Since we were elected we've trebled the amount of wind power in Australia.,mostly true,http://pandora.nla.gov.au//pan/140601/20131209-1141/www.politifact.com.au/truth-o-meter/statements/2013/aug/28/mark-butler/youve-got-wind-power-it-thanks-labor/index.html,,"['Carbon Tax', 'Environment']",Mark Butler,"Michael Koziol, Peter Fray",,You've got the (wind) power! But is it thanks to Labor?,"Wednesday, August 28, 2013 at 4:18 p.m.",,['Australia'],train,since we were elected we ve trebled the amount of wind power in australia,"['Carbon Tax', 'Environment']",[],Carbon Tax | Environment,,carbon tax | environment | ,13,pandora.nla.gov.au,True
snes-05628,"In accordance with a requirement of their original Royal Charter, the Hudson's Bay Company of Canada makes annual payments of elk and beaver pelts to the Queen of England.",false,https://www.snopes.com/fact-check/fur-the-queen/,,Business,,David Mikkelson,,Canada Company Makes Annual Fur Payments to the Queen,15 June 2001,,"['England', 'Canada']",train,in accordance with a requirement of their original royal charter the hudson s bay company of canada makes annual payments of elk and beaver pelts to the queen of england,['Business'],[],Business,,business | ,29,www.snopes.com,True
