matched_pair_id,pair_source,pair_role,claim,pure_binary_label,original_verdict,normalised_rating,financial_matches,word_count,pair_has_shared_concept,pair_shared_concept_count,pair_concept_jaccard,pair_word_difference,date_published,url,claim_id,row_id,finance_relevant,label_valid,standalone_claim,no_editorial_framing,keep,audit_notes,automatic_editorial_flag,automatic_long_claim_flag,automatic_large_pair_length_gap,automatic_no_shared_concept,row_risk_score,audit_priority
politifact_145,PolitiFact,misleading,"""Your Social Security will be destroyed by the people coming in. There's too many of them. It's not sustainable.""",misleading,false,False,['pension'],19,True,1,1.0,2,2024-03-20T00:00:00,https://www.politifact.com/factchecks/2024/mar/20/donald-trump/donald-trumps-false-claim-that-immigration-hurts-s/,58753,61028,,,,,,,False,False,False,False,0,131
politifact_146,PolitiFact,genuine,"The federal government is spending $46,000 a year per family and could balance its budget by dropping that to $30,000.",genuine,true,True,['budget'],20,True,1,1.0,2,2011-09-28T00:00:00,https://www.politifact.com/factchecks/2011/sep/28/mark-neumann/mark-neumann-says-federal-government-spends-46000-/,69265,71766,,,,,,,False,False,False,False,0,132
politifact_146,PolitiFact,misleading,"Says the U.S. Senate has passed ""a budget"" over the last three years ""called the Budget Control Act.""",misleading,false,False,['budget'],18,True,1,1.0,2,2012-10-14T00:00:00,https://www.politifact.com/factchecks/2012/oct/14/robert-menendez/us-sen-robert-menendez-says-budget-control-act-fed/,70820,73321,,,,,,,False,False,False,False,0,132
politifact_147,PolitiFact,genuine,"Says the United States ""actually exports more gasoline, diesel and other fuels than it imported in 2011 for the first time since, I think, 1949.""",genuine,true,True,['trade'],25,True,1,1.0,2,2012-04-11T00:00:00,https://www.politifact.com/factchecks/2012/apr/11/robert-menendez/robert-menendez-claims-us-oil-exports-surpassed-im/,70435,72936,,,,,,,False,False,False,False,0,133
politifact_147,PolitiFact,misleading,"Says Gov. Ron DeSantis ""opposed my China tariffs and he heartlessly opposed"" $28 billion for farm relief, which was paid for by China.",misleading,false,False,['trade'],23,True,1,1.0,2,2023-08-08T00:00:00,https://www.politifact.com/factchecks/2023/aug/08/donald-trump/trump-keeps-saying-ron-desantis-opposed-china-tari/,59038,61326,,,,,,,False,False,False,False,0,133
politifact_148,PolitiFact,genuine,"President Obama budget request for veterans is ""more than double the amount in constant dollars appropriated in 1980, when the veterans population was larger by a third.""",genuine,true,True,['budget'],27,True,1,1.0,2,2012-06-04T00:00:00,https://www.politifact.com/factchecks/2012/jun/04/jim-webb/jim-webb-says-veteran-funding-has-risen-dramatical/,70551,73052,,,,,,,False,False,False,False,0,134
politifact_148,PolitiFact,misleading,"Says, ""Yet in Salem they have traditionally waited until the money is almost gone to pay for the most important things in our state's budget.""",misleading,false,False,['budget'],25,True,1,1.0,2,2012-06-26T00:00:00,https://www.politifact.com/factchecks/2012/jun/26/shawn-lindsay/does-salem-traditionally-wait-until-money-almost-g/,70586,73087,,,,,,,False,False,False,False,0,134
politifact_149,PolitiFact,genuine,Says spending in the fiscal 2009 budget was lower than spending in the fiscal 2014 budget,genuine,true,True,['budget'],16,True,1,1.0,2,2013-07-07T00:00:00,https://www.politifact.com/factchecks/2013/jul/07/barbara-buono/barbara-buono-claims-state-spending-was-lower-fy20/,71134,73635,,,,,,,False,False,False,False,0,135
politifact_149,PolitiFact,misleading,"A referendum ""gives the people the chance to decide"" on cutting the Milwaukee County Board budget by two-thirds",misleading,false,False,['budget'],18,True,1,1.0,2,2013-05-22T00:00:00,https://www.politifact.com/factchecks/2013/may/22/leah-vukmir/state-senator-says-referendum-county-board-broad/,71081,73582,,,,,,,False,False,False,False,0,135
politifact_150,PolitiFact,genuine,"""By the time she turns 3 years old, a child born into a low-income home hears 30 million fewer words than a child from a well-off family.""",genuine,true,True,['income'],27,True,1,1.0,2,2013-12-05T00:00:00,https://www.politifact.com/factchecks/2013/dec/05/barack-obama/obama-says-children-low-income-families-hear-30-mi/,71320,73821,,,,,,,False,False,False,False,0,136
politifact_150,PolitiFact,misleading,"Says Hillary Clinton is ""proposing to print instant work permits for millions of illegal immigrants to come in and take everybody's jobs, including low-income African-Americans.""",misleading,false,False,['income'],25,True,1,1.0,2,2016-08-18T00:00:00,https://www.politifact.com/factchecks/2016/aug/18/donald-trump/hillary-clinton-want-millions-illegal-immigrants-t/,64242,66731,,,,,,,False,False,False,False,0,136
politifact_151,PolitiFact,genuine,"Since 1978, college ""tuition nationwide has gone up something like four times the rate of inflation.""",genuine,true,True,['inflation'],16,True,1,1.0,2,2016-06-09T00:00:00,https://www.politifact.com/factchecks/2016/jun/09/scott-walker/scott-walker-says-college-tuition-has-risen-four-t/,72533,75040,,,,,,,False,False,False,False,0,137
politifact_151,PolitiFact,misleading,"""No economist out there is projecting that will have a negative impact on inflation.""",misleading,false,False,['inflation'],14,True,1,1.0,2,2021-11-18T00:00:00,https://www.politifact.com/factchecks/2021/nov/18/jen-psaki/jen-psaki-wrong-say-no-economist-thinks-b/,60122,62471,,,,,,,False,False,False,False,0,137
politifact_152,PolitiFact,genuine,"""One"" Texas school ""district alone -- Austin ISD -- is expected to lose more than $530 million in local property taxes to Robin Hood this year.""",genuine,true,True,['tax'],26,True,1,1.0,2,2017-07-19T00:00:00,https://www.politifact.com/factchecks/2017/jul/19/joe-straus/joe-straus-says-austin-school-district-expected-lo/,73170,75682,,,,,,,False,False,False,False,0,138
politifact_152,PolitiFact,misleading,"A proposed tax to fund transportation projects would spend $90,000 to take a single vehicle off the road during the morning and afternoon commute.",misleading,false,False,['tax'],24,True,1,1.0,2,2012-07-24T00:00:00,https://www.politifact.com/factchecks/2012/jul/24/steve-brown/Transportation-tax-foes-number-crunching-flawed/,70632,73133,,,,,,,False,False,False,False,0,138
politifact_185,PolitiFact,genuine,"""Adjusting for inflation, West Virginia's median household income has not grown in a decade.""",genuine,true,True,"['inflation', 'income']",14,True,1,0.5,2,2018-12-12T00:00:00,https://www.politifact.com/factchecks/2018/dec/12/mike-romano/have-median-incomes-west-virginia-not-risen-decade/,73879,76399,,,,,,,False,False,False,False,0,139
politifact_185,PolitiFact,misleading,"The Inflation Reduction Act, which Rep. Elissa Slotkin supported, ""drove inflation higher.""",misleading,false,False,['inflation'],12,True,1,0.5,2,2024-09-26T00:00:00,https://www.politifact.com/factchecks/2024/sep/26/americans-for-prosperity-action/ad-targeting-elissa-slotkin-on-inflation-reduction/,58479,60731,,,,,,,False,False,False,False,0,139
politifact_193,PolitiFact,genuine,"""Our trade deficit in goods reached nearly … $800 billion last year alone.""",genuine,true,True,"['deficit', 'trade']",13,True,1,0.3333333333333333,2,2016-07-22T00:00:00,https://www.politifact.com/factchecks/2016/jul/22/donald-trump/donald-trump-says-goods-trade-deficit-was-almost-8/,64342,66831,,,,,,,False,False,False,False,0,140
politifact_193,PolitiFact,misleading,"Says he faced ""a record budget deficit"" in Virginia in 2014.",misleading,false,False,"['budget', 'deficit']",11,True,1,0.3333333333333333,2,2015-12-21T00:00:00,https://www.politifact.com/factchecks/2015/dec/21/terry-mcauliffe/mcauliffes-misspoken-claim-about-facing-record-def/,64910,67401,,,,,,,False,False,False,False,0,140
politifact_194,PolitiFact,genuine,"""The average family in America forks over more of their hard-earned income to their local hospital than to the IRS.""",genuine,true,True,['income'],20,True,1,0.3333333333333333,2,2020-07-22T00:00:00,https://www.politifact.com/factchecks/2020/jul/22/mike-gallagher/yes-average-american-family-pays-more-hospital-exp/,75044,77618,,,,,,,False,False,False,False,0,141
politifact_194,PolitiFact,misleading,"The North Carolina state budget includes ""the largest cut in our personal income tax that we've ever seen.""",misleading,false,False,"['tax', 'budget', 'income']",18,True,1,0.3333333333333333,2,2023-10-09T00:00:00,https://www.politifact.com/factchecks/2023/oct/09/tricia-cotham/cotham-falsely-says-nc-budget-includes-largest-eve/,77744,80444,,,,,,,False,False,False,False,0,141
snopes_002,Snopes,genuine,Amazon paid zero dollars in federal income tax in 2017.,genuine,true,True,"['tax', 'income']",10,True,2,1.0,2,2018-09-26T09:13:50,https://www.snopes.com/fact-check/amazon-federal-taxes-2017/,90137,93482,,,,,,,False,False,False,False,0,142
snopes_002,Snopes,misleading,Payment of U.S. federal income taxes is voluntary.,misleading,false,False,"['tax', 'income']",8,True,2,1.0,2,2010-04-14T18:58:58,https://www.snopes.com/fact-check/is-income-tax-voluntary/,96607,100067,,,,,,,False,False,False,False,0,142
snopes_052,Snopes,genuine,President Donald Trump has proposed eliminating funding for a program helping low-income families with their heating bills.,genuine,true,True,['income'],17,True,1,1.0,2,2017-11-02T15:38:38,https://www.snopes.com/fact-check/does-president-trump-plan-to-end-a-program-funding-heating-for-the-elderly-and-disabled/,84450,87565,,,,,,,False,False,False,False,0,143
snopes_052,Snopes,misleading,Coca-Cola has announced that it will be donating four days' worth of income to Israel,misleading,false,False,['income'],15,True,1,1.0,2,2002-05-08T12:00:00,https://www.snopes.com/fact-check/coke-adds-strife/,98456,101924,,,,,,,False,False,False,False,0,143
snopes_053,Snopes,genuine,People without permanent homes who do not normally file taxes can submit information to the IRS in order to receive stimulus payments as part of the March 2021 COVID-19 relief bill.,genuine,true,True,['tax'],31,True,1,1.0,2,2021-03-23T11:08:21,https://www.snopes.com/fact-check/homeless-stimulus-payment/,86590,89779,,,,,,,False,False,False,False,0,144
snopes_053,Snopes,misleading,"The Build Back Better Act of 2021 included proposals to introduce a ""methane tax"" that would equate to $2,600 per head of cattle and $500 per head of swine.",misleading,false,False,['tax'],29,True,1,1.0,2,2021-11-02T11:46:00,https://www.snopes.com/fact-check/methane-tax-cattle-pigs/,85492,88652,,,,,,,False,False,False,False,0,144
snopes_054,Snopes,genuine,Joel Osteen's Lakewood Church in Texas received $4.4 million in coronavirus-economic-relief loans.,genuine,true,True,['loan'],12,True,1,1.0,2,2020-12-23T12:50:10,https://www.snopes.com/fact-check/osteen-coronavirus-loan/,87267,90469,,,,,,,False,False,False,False,0,145
snopes_054,Snopes,misleading,"Colorado Rep. Lauren Boebert's restaurant received a $233,000 PPP loan.",misleading,false,False,['loan'],10,True,1,1.0,2,2021-07-12T07:59:36,https://www.snopes.com/fact-check/boebert-ppp-loan/,85871,89045,,,,,,,False,False,False,False,0,145
snopes_055,Snopes,genuine,"The Trump administration is paying Southwest Key $458 million to run immigrant child detention centers, and its CEO earns a $1.5 million salary.",genuine,true,True,['employment'],23,True,1,1.0,2,2018-06-22T09:09:23,https://www.snopes.com/fact-check/is-trump-administration-southwest-key-458-million/,90484,93835,,,,,,,False,False,False,False,0,146
snopes_055,Snopes,misleading,The government understates the unemployment rate because they report how many people are collecting unemployment insurance rather than how many people are out of work,misleading,false,False,['employment'],25,True,1,1.0,2,2001-04-23T12:00:00,https://www.snopes.com/fact-check/dole-call/,98747,102216,,,,,,,False,False,False,False,0,146
snopes_056,Snopes,genuine,A misplaced comma once deprived the U.S. government of an estimated <NOBR>$1 million</NOBR> in revenues.,genuine,true,True,['company_finance'],15,True,1,1.0,2,2010-09-09T17:00:02,https://www.snopes.com/fact-check/million-dollar-comma/,96544,100004,,,,,,,False,False,False,False,0,147
snopes_056,Snopes,misleading,Usain Bolt donated his entire $20 million earnings from the Olympic Games to his Jamaican high school.,misleading,false,False,['company_finance'],17,True,1,1.0,2,2016-08-26T14:35:24,https://www.snopes.com/fact-check/usain-bolt-donates-earnings/,93416,96818,,,,,,,False,False,False,False,0,147
snopes_057,Snopes,genuine,A moratorium on Internet taxation expires in 2007,genuine,true,True,['tax'],8,True,1,1.0,2,2003-10-31T12:00:00,https://www.snopes.com/fact-check/internet-taxation-moratorium/,98073,101540,,,,,,,False,False,False,False,0,148
snopes_057,Snopes,misleading,Facebook uses birthday donations from its users as tax-deductible write-offs.,misleading,false,False,['tax'],10,True,1,1.0,2,2019-11-06T12:21:27,https://www.snopes.com/fact-check/facebook-write-off-birthdays/,88912,92189,,,,,,,False,False,False,False,0,148
snopes_058,Snopes,genuine,Crook posing as security guard places 'OUT OF ORDER' sign on bank's night depository and collects depositors' money himself,genuine,true,True,['banking'],19,True,1,1.0,2,2000-12-03T12:00:00,https://www.snopes.com/fact-check/on-guard/,98880,102349,,,,,,,False,False,False,False,0,149
snopes_058,Snopes,misleading,"Law enforcement officials and Danske Bank are cautioning that a ""smishing"" scam is taking money directly out of people's bank accounts.",misleading,false,False,['banking'],21,True,1,1.0,2,2020-03-31T15:44:18,https://www.snopes.com/fact-check/danske-bank-text-scam/,88449,91698,,,,,,,False,False,False,False,0,149
